start send sms 27.10.2015 19:30:01 from onair pages (FOR TODAY) 
start send sms 27.10.2015 19:30:01 from onair pages 
start send sms 27.10.2015 19:30:01 from newlp2 pages 
start send sms 28.10.2015 00:06:23 from onair pages (FOR TODAY) 
start send sms 28.10.2015 00:06:23 from onair pages 
start send sms 28.10.2015 00:06:23 from newlp2 pages 
start send sms 28.10.2015 00:07:33 from onair pages (FOR TODAY) 
start send sms 28.10.2015 00:07:33 from onair pages 
start send sms 28.10.2015 00:07:33 from newlp2 pages 
start send sms 28.10.2015 00:07:34 from onair pages (FOR TODAY) 
start send sms 28.10.2015 00:07:34 from onair pages 
start send sms 28.10.2015 00:07:34 from newlp2 pages 
start send sms 28.10.2015 00:07:52 from onair pages (FOR TODAY) 
start send sms 28.10.2015 00:07:52 from onair pages 
start send sms 28.10.2015 00:07:52 from newlp2 pages 
start send sms 28.10.2015 00:07:53 from onair pages (FOR TODAY) 
start send sms 28.10.2015 00:07:53 from onair pages 
start send sms 28.10.2015 00:07:53 from newlp2 pages 
start send sms 28.10.2015 00:07:54 from onair pages (FOR TODAY) 
start send sms 28.10.2015 00:07:54 from onair pages 
start send sms 28.10.2015 00:07:54 from newlp2 pages 
start send sms 28.10.2015 00:07:54 from onair pages (FOR TODAY) 
start send sms 28.10.2015 00:07:54 from onair pages 
start send sms 28.10.2015 00:07:54 from newlp2 pages 
start send sms 28.10.2015 00:07:55 from onair pages (FOR TODAY) 
start send sms 28.10.2015 00:07:55 from onair pages 
start send sms 28.10.2015 00:07:55 from newlp2 pages 
start send sms 28.10.2015 00:07:55 from onair pages (FOR TODAY) 
start send sms 28.10.2015 00:07:55 from onair pages 
start send sms 28.10.2015 00:07:55 from newlp2 pages 
start send sms 28.10.2015 00:07:55 from onair pages (FOR TODAY) 
start send sms 28.10.2015 00:07:55 from onair pages 
start send sms 28.10.2015 00:07:55 from newlp2 pages 
start send sms 28.10.2015 00:08:18 from onair pages (FOR TODAY) 
start send sms 28.10.2015 00:08:18 from onair pages 
start send sms 28.10.2015 00:08:18 from newlp2 pages 
start send sms 28.10.2015 00:08:19 from onair pages (FOR TODAY) 
start send sms 28.10.2015 00:08:19 from onair pages 
start send sms 28.10.2015 00:08:19 from newlp2 pages 
start send sms 28.10.2015 00:10:40 from onair pages (FOR TODAY) 
start send sms 28.10.2015 00:10:40 from onair pages 
start send sms 28.10.2015 00:10:40 from newlp2 pages 
start send sms 28.10.2015 00:12:29 from onair pages (FOR TODAY) 
start send sms 28.10.2015 00:12:29 from onair pages 
#SMS_3dbiz 2015-10-28 00:12:29 79103608808 1
start send sms 28.10.2015 00:12:29 from newlp2 pages 
#SMS_newlp2 2015-10-28 00:12:29 +79128889222 1
#SMS_newlp2 2015-10-28 00:12:29 +7 918 1626157 1
#SMS_newlp2 2015-10-28 00:12:29 +79851950521 1
#SMS_newlp2 2015-10-28 00:12:29 +79897674088 1
#SMS_newlp2 2015-10-28 00:12:29 +79672993101 1
#SMS_newlp2 2015-10-28 00:12:29 +79672993101 1
#SMS_newlp2 2015-10-28 00:12:29 +79175989793 1
start send sms 28.10.2015 19:30:01 from onair pages (FOR TODAY) 
#SMS_3dbizToday  998911451313 517
start send sms 28.10.2015 19:30:02 from onair pages 
#SMS_3dbiz 2015-10-28 19:29:49 79103608808 1
start send sms 28.10.2015 19:30:02 from newlp2 pages 
#SMS_newlp2 2015-10-28 19:29:50 +79128889222 1
#SMS_newlp2 2015-10-28 19:29:50 +7 918 1626157 1
#SMS_newlp2 2015-10-28 19:29:50 +79851950521 1
#SMS_newlp2 2015-10-28 19:29:50 +79897674088 1
#SMS_newlp2 2015-10-28 19:29:50 +79672993101 1
#SMS_newlp2 2015-10-28 19:29:51 +79672993101 1
#SMS_newlp2 2015-10-28 19:29:51 +79175989793 1
start send sms 29.10.2015 19:30:01 from onair pages (FOR TODAY) 
#SMS_3dbizToday 2015-10-29 19:30:02 79253844842 1
#SMS_3dbizToday 2015-10-29 19:30:02 79265747206 1
#SMS_3dbizToday 2015-10-29 19:30:03 89036286581 1
#SMS_3dbizToday 2015-10-29 19:30:03 89148982091 1
#SMS_3dbizToday  998998167723 517
start send sms 29.10.2015 19:30:04 from onair pages 
#SMS_3dbiz 2015-10-29 19:30:04 79526153887 1
#SMS_3dbiz 2015-10-29 19:30:04 905367473548 1
#SMS_3dbiz 2015-10-29 19:30:05 79142057935 1
#SMS_3dbiz 2015-10-29 19:30:05 79166512414 1
#SMS_3dbiz 2015-10-29 19:30:06 79324080011 1
#SMS_3dbiz 2015-10-29 19:30:07 79241808899 1
#SMS_3dbiz 2015-10-29 19:30:08 89086671558 1
start send sms 29.10.2015 19:30:08 from newlp2 pages 
#SMS_newlp2 2015-10-29 19:30:08 +79266042908 1
#SMS_newlp2 2015-10-29 19:30:08 +79641020582 1
#SMS_newlp2 2015-10-29 19:30:08 +7 (953) 079 32 61 1
#SMS_newlp2 2015-10-29 19:30:09 +79262540055 1
#SMS_newlp2  +998915228889 517
#SMS_newlp2 2015-10-29 19:30:09 +79608483193 1
#SMS_newlp2 2015-10-29 19:30:09 +79114549761 1
#SMS_newlp2 2015-10-29 19:30:10 +79104800063 1
#SMS_newlp2 2015-10-29 19:30:10 +79262570192 1
#SMS_newlp2 2015-10-29 19:30:10 89005825234 1
#SMS_newlp2 2015-10-29 19:30:10 89005825234 1
#SMS_newlp2 2015-10-29 19:30:10 89005825234 1
#SMS_newlp2 2015-10-29 19:30:11 89166672460 1
#SMS_newlp2 2015-10-29 19:30:11 +79184822076 1
#SMS_newlp2  +998946988007 517
#SMS_newlp2 2015-10-29 19:30:12 +79627461282 1
#SMS_newlp2 2015-10-29 19:30:12 +79831221266 1
#SMS_newlp2 2015-10-29 19:30:13 89160696712 1
start send sms 30.10.2015 19:30:01 from onair pages (FOR TODAY) 
#SMS_3dbizToday 2015-10-30 19:29:59 89207560074 1
#SMS_3dbizToday 2015-10-30 19:29:59 79280400791 1
#SMS_3dbizToday 2015-10-30 19:29:59 79033220708 1
#SMS_3dbizToday 2015-10-30 19:29:59 79080863070 1
start send sms 30.10.2015 19:30:02 from onair pages 
#SMS_3dbiz 2015-10-30 19:30:00 79185196862 1
#SMS_3dbiz 2015-10-30 19:30:00 89086671558 1
#SMS_3dbiz  998935540258 517
#SMS_3dbiz 2015-10-30 19:30:00 79857645028 1
#SMS_3dbiz 2015-10-30 19:30:00 79649219299 1
#SMS_3dbiz 2015-10-30 19:30:00 79817719086 1
start send sms 30.10.2015 19:30:03 from newlp2 pages 
#SMS_newlp2 2015-10-30 19:30:01 +79105537474 1
#SMS_newlp2 2015-10-30 19:30:01 +79185196862 1
#SMS_newlp2  +998935540258 517
#SMS_newlp2 2015-10-30 19:30:01 89269663417 1
#SMS_newlp2 2015-10-30 19:30:01 89110189942 1
#SMS_newlp2 2015-10-30 19:30:02 +7 (916) 190-16-32 1
#SMS_newlp2 2015-10-30 19:30:02 +79514151563 1
#SMS_newlp2 2015-10-30 19:30:02 89207560074 1
#SMS_newlp2 2015-10-30 19:30:02 +79104628804 1
#SMS_newlp2 2015-10-30 19:30:03 +79281465152 1
#SMS_newlp2 2015-10-30 19:30:03 +79649219299 1
#SMS_newlp2 2015-10-30 19:30:03 +79295765189 1
start send sms 31.10.2015 19:30:01 from onair pages (FOR TODAY) 
#SMS_3dbizToday 2015-10-31 19:29:57 87078862677 1
start send sms 31.10.2015 19:30:02 from onair pages 
#SMS_3dbiz 2015-10-31 19:29:57 380981298525 1
#SMS_3dbiz 2015-10-31 19:29:58 79161433139 1
#SMS_3dbiz 2015-10-31 19:29:58 79021076370 1
#SMS_3dbiz 2015-10-31 19:29:58 79517170121 1
#SMS_3dbiz 2015-10-31 19:29:58 89057030880 1
#SMS_3dbiz 2015-10-31 19:29:58 79217977593 1
start send sms 31.10.2015 19:30:03 from newlp2 pages 
#SMS_newlp2 2015-10-31 19:29:59 +380958247989 1
#SMS_newlp2 2015-10-31 19:29:59 +380981298525 1
#SMS_newlp2 2015-10-31 19:29:59 79645580004 1
#SMS_newlp2 2015-10-31 19:29:59 +7(909)8746801 1
#SMS_newlp2 2015-10-31 19:29:59 89673622052 1
#SMS_newlp2 2015-10-31 19:30:00 +79161433139 1
#SMS_newlp2 2015-10-31 19:30:00 +7(982)633-25-90 1
#SMS_newlp2 2015-10-31 19:30:00 8911-504-42-29 1
#SMS_newlp2 2015-10-31 19:30:00 +79267208842 1
#SMS_newlp2 2015-10-31 19:30:00 +79609710530 1
#SMS_newlp2 2015-10-31 19:30:00 +79035000588 1
start send sms 01.11.2015 19:30:01 from onair pages (FOR TODAY) 
#SMS_3dbizToday 2015-11-01 19:29:55 79280468292 1
#SMS_3dbizToday 2015-11-01 19:29:55 79213153732 1
#SMS_3dbizToday 2015-11-01 19:29:55 89213153732 1
start send sms 01.11.2015 19:30:02 from onair pages 
#SMS_3dbiz 2015-11-01 19:29:55 89659993805 1
#SMS_3dbiz 2015-11-01 19:29:56 89081314421 1
#SMS_3dbiz 2015-11-01 19:29:56 89627948660 1
#SMS_3dbiz 2015-11-01 19:29:56 79122810830 1
start send sms 01.11.2015 19:30:03 from newlp2 pages 
#SMS_newlp2  + 510
#SMS_newlp2  +998935770748 517
#SMS_newlp2 2015-11-01 19:29:56 +79181151333 1
#SMS_newlp2  +37477131710 517
#SMS_newlp2 2015-11-01 19:29:57 +380961495353 1
#SMS_newlp2 2015-11-01 19:29:57 +79142659901 1
#SMS_newlp2 2015-11-01 19:29:57 +7(910)2344055 1
#SMS_newlp2 2015-11-01 19:29:57 +79280468292 1
#SMS_newlp2 2015-11-01 19:29:57 +7 (912) 281-08-30 1
start send sms 02.11.2015 19:30:01 from onair pages (FOR TODAY) 
#SMS_3dbizToday 2015-11-02 19:29:52 79054933176 1
#SMS_3dbizToday 2015-11-02 19:29:53 79277052525 1
start send sms 02.11.2015 19:30:02 from onair pages 
#SMS_3dbiz 2015-11-02 19:29:53 79105815186 1
#SMS_3dbiz 2015-11-02 19:29:53 79195748688 1
#SMS_3dbiz 2015-11-02 19:29:53 79113355888 1
start send sms 02.11.2015 19:30:02 from newlp2 pages 
#SMS_newlp2 2015-11-02 19:29:53 +7(963)722-54-52 1
#SMS_newlp2 2015-11-02 19:29:54 79195748688 1
#SMS_newlp2 2015-11-02 19:29:54 89126199739 1
#SMS_newlp2 2015-11-02 19:29:54 +79265275522 1
#SMS_newlp2 2015-11-02 19:29:54 +380632845755 1
#SMS_newlp2 2015-11-02 19:29:54 +7 (927) 979-37-75 1
#SMS_newlp2 2015-11-02 19:29:54 +79178098425 1
#SMS_newlp2 2015-11-02 19:29:55 +7 (911) 362 18 27 1
start send sms 03.11.2015 19:30:01 from onair pages (FOR TODAY) 
#SMS_3dbizToday 2015-11-03 19:29:51 79195748688 1
start send sms 03.11.2015 19:30:02 from onair pages 
#SMS_3dbiz 2015-11-03 19:29:51 89528059636 1
#SMS_3dbiz 2015-11-03 19:29:51 79262129995 1
start send sms 03.11.2015 19:30:02 from newlp2 pages 
#SMS_newlp2 2015-11-03 19:29:52 89244521783 1
#SMS_newlp2 2015-11-03 19:29:52 +79519022990 1
#SMS_newlp2 2015-11-03 19:29:52 +79151730477 1
#SMS_newlp2 2015-11-03 19:29:52 +7 (985) 749-17-08 1
start send sms 04.11.2015 19:30:01 from onair pages (FOR TODAY) 
#SMS_3dbizToday 2015-11-04 19:29:48 79036521451 1
start send sms 04.11.2015 19:30:02 from onair pages 
#SMS_3dbiz 2015-11-04 19:29:49 89164956844 1
#SMS_3dbiz 2015-11-04 19:29:49 79174777203 1
start send sms 04.11.2015 19:30:02 from newlp2 pages 
#SMS_newlp2 2015-11-04 19:29:49 +79203541737 1
#SMS_newlp2 2015-11-04 19:29:49 +7 (922) 239-70-56 1
#SMS_newlp2 2015-11-04 19:29:50 +79263989342 1
#SMS_newlp2 2015-11-04 19:29:50 +79036521451 1
#SMS_newlp2 2015-11-04 19:29:50 +79111250416 1
#SMS_newlp2 2015-11-04 19:29:50 8(903)148-92-52 1
#SMS_newlp2 2015-11-04 19:29:50 +77755631714 1
#SMS_newlp2 2015-11-04 19:29:51 +79165246792 1
#SMS_newlp2 2015-11-04 19:29:51 +79020457463 1
start send sms 05.11.2015 19:30:01 from onair pages (FOR TODAY) 
#SMS_3dbizToday 2015-11-05 19:29:46 77025689510 1
#SMS_3dbizToday 2015-11-05 19:29:46 79637109606 1
#SMS_3dbizToday 2015-11-05 19:29:46 79141726406 1
start send sms 05.11.2015 19:30:02 from onair pages 
#SMS_3dbiz 2015-11-05 19:29:47 79267008766 1
#SMS_3dbiz 2015-11-05 19:29:47 380636839468 1
start send sms 05.11.2015 19:30:02 from newlp2 pages 
#SMS_newlp2 2015-11-05 19:29:47 89154317454 1
#SMS_newlp2 2015-11-05 19:29:47 +79033074354 1
#SMS_newlp2 2015-11-05 19:29:47 89670341182 1
#SMS_newlp2 2015-11-05 19:29:47 +7 912 2468431 1
#SMS_newlp2 2015-11-05 19:29:48 +79787064074 1
#SMS_newlp2 2015-11-05 19:29:48 +79616923915 1
#SMS_newlp2 2015-11-05 19:29:48 +79269059662 1
#SMS_newlp2 2015-11-05 19:29:48 +79896359348 1
#SMS_newlp2 2015-11-05 19:29:48 89210684505 1
start send sms 06.11.2015 18:17:09 from onair pages (FOR TODAY) 
#SMS_3dbizToday 2015-11-06 18:16:52 89518625554 1
start send sms 06.11.2015 18:17:09 from onair pages 
#SMS_3dbiz  66972721719 517
#SMS_3dbiz 2015-11-06 18:16:52 89205878585 1
#SMS_3dbiz 2015-11-06 18:16:52 992917479191 1
start send sms 06.11.2015 18:17:10 from newlp2 pages 
#SMS_newlp2 2015-11-06 18:16:53 89684359884 1
#SMS_newlp2 2015-11-06 18:16:53 +79156562060 1
#SMS_newlp2 2015-11-06 18:16:53 89141913590 1
#SMS_newlp2 2015-11-06 18:16:53 +79199625249 1
start send sms 06.11.2015 19:30:01 from onair pages (FOR TODAY) 
start send sms 06.11.2015 19:30:01 from onair pages 
start send sms 06.11.2015 19:30:01 from newlp2 pages 
start send sms 07.11.2015 19:30:01 from onair pages (FOR TODAY) 
#SMS_3dbizToday 2015-11-07 19:30:00 79833639953 1
#SMS_3dbizToday 2015-11-07 19:30:00 9148457374 1
start send sms 07.11.2015 19:30:02 from onair pages 
#SMS_3dbiz 2015-11-07 19:30:00 79081561585 1
#SMS_3dbiz 2015-11-07 19:30:00 380632739033 1
#SMS_3dbiz 2015-11-07 19:30:01 9851353801 1
#SMS_3dbiz 2015-11-07 19:30:01 79878759309 1
start send sms 07.11.2015 19:30:02 from newlp2 pages 
#SMS_newlp2 2015-11-07 19:30:01 +79301166503 1
#SMS_newlp2 2015-11-07 19:30:01 +79151416993 1
#SMS_newlp2  +998974302321 517
#SMS_newlp2 2015-11-07 19:30:01 +380506844644 1
#SMS_newlp2 2015-11-07 19:30:02 +79373200102 1
#SMS_newlp2 2015-11-07 19:30:02 +380661030347 1
#SMS_newlp2 2015-11-07 19:30:03 +380504210037 1
#SMS_newlp2 2015-11-07 19:30:03 +7 927 272 5153 1
#SMS_newlp2 2015-11-07 19:30:03 +7(9173838304 1
#SMS_newlp2 2015-11-07 19:30:03 +79246143942 1
#SMS_newlp2 2015-11-07 19:30:03 89035645757 1
#SMS_newlp2 2015-11-07 19:30:04 +380676707205 1
#SMS_newlp2 2015-11-07 19:30:04 +380500591137 1
start send sms 08.11.2015 19:30:02 from onair pages (FOR TODAY) 
#SMS_3dbizToday 2015-11-08 19:29:58 79617909062 1
#SMS_3dbizToday  3800672343281 517
start send sms 08.11.2015 19:30:02 from onair pages 
#SMS_3dbiz 2015-11-08 19:29:59 89532779171 1
#SMS_3dbiz 2015-11-08 19:29:59 79205556666 1
start send sms 08.11.2015 19:30:02 from newlp2 pages 
#SMS_newlp2 2015-11-08 19:29:59 +79632497102 1
#SMS_newlp2 2015-11-08 19:29:59 +79833639953 1
#SMS_newlp2  +998973004343 517
#SMS_newlp2 2015-11-08 19:29:59 +992901101221 1
#SMS_newlp2 2015-11-08 19:29:59 89532779171 1
#SMS_newlp2 2015-11-08 19:30:00 380984483225 1
#SMS_newlp2 2015-11-08 19:30:00 +79504274772 1
#SMS_newlp2  +998942835855 517
#SMS_newlp2 2015-11-08 19:30:00 89818437181 1
#SMS_newlp2 2015-11-08 19:30:00 +7 (978) 858-39-08 1
#SMS_newlp2 2015-11-08 19:30:01 +7 (916) 634 03 41 1
#SMS_newlp2 2015-11-08 19:30:01 89174571454 1
start send sms 09.11.2015 19:30:01 from onair pages (FOR TODAY) 
#SMS_3dbizToday 2015-11-09 19:29:55 79634848161 1
start send sms 09.11.2015 19:30:01 from onair pages 
#SMS_3dbiz 2015-11-09 19:29:55 79643426644 1
#SMS_3dbiz 2015-11-09 19:29:56 79300744440 1
#SMS_3dbiz 2015-11-09 19:29:56 79269566888 1
start send sms 09.11.2015 19:30:02 from newlp2 pages 
#SMS_newlp2 2015-11-09 19:29:56 +79141588366 1
#SMS_newlp2 2015-11-09 19:29:56 9035817379 1
#SMS_newlp2 2015-11-09 19:29:56 +7(914)2659901 1
#SMS_newlp2 2015-11-09 19:29:57 +79133071234 1
#SMS_newlp2 2015-11-09 19:29:57 89637816324 1
#SMS_newlp2  +34 667830677 517
#SMS_newlp2 2015-11-09 19:29:57 +79510951240 1
#SMS_newlp2  +99897 277-05-30 517
start send sms 10.11.2015 19:30:01 from onair pages (FOR TODAY) 
#SMS_3dbizToday 2015-11-10 19:29:53 79146952133 1
#SMS_3dbizToday 2015-11-10 19:29:53 79153059072 1
#SMS_3dbizToday 2015-11-10 19:29:54 998909688211 1
start send sms 10.11.2015 19:30:02 from onair pages 
#SMS_3dbiz 2015-11-10 19:29:54 79624036650 1
#SMS_3dbiz 2015-11-10 19:29:54 89178240343 1
#SMS_3dbiz 2015-11-10 19:29:54 89123223388 1
start send sms 10.11.2015 19:30:02 from newlp2 pages 
#SMS_newlp2 2015-11-10 19:29:54 +79015433458 1
#SMS_newlp2 2015-11-10 19:29:55 +7 (962) 403-66-50 1
#SMS_newlp2 2015-11-10 19:29:55 +79521356608 1
#SMS_newlp2 2015-11-10 19:29:55 89104379975 1
#SMS_newlp2 2015-11-10 19:29:55 89123223388 1
start send sms 11.11.2015 19:30:01 from onair pages (FOR TODAY) 
#SMS_3dbizToday 2015-11-11 19:29:51 89609150121 1
start send sms 11.11.2015 19:30:02 from onair pages 
#SMS_3dbiz 2015-11-11 19:29:52 79523665779 1
#SMS_3dbiz 2015-11-11 19:29:52 79262695732 1
#SMS_3dbiz 2015-11-11 19:29:52 79188999800 1
#SMS_3dbiz  99365822435 517
#SMS_3dbiz 2015-11-11 19:29:53 79183173767 1
#SMS_3dbiz 2015-11-11 19:29:53 89500033255 1
#SMS_3dbiz 2015-11-11 19:29:53 89193614505 1
#SMS_3dbiz 2015-11-11 19:29:53 89373612574 1
#SMS_3dbiz 2015-11-11 19:29:53 79857642804 1
#SMS_3dbiz 2015-11-11 19:29:53 79119306966 1
#SMS_3dbiz 2015-11-11 19:29:54 79028778053 1
#SMS_3dbiz 2015-11-11 19:29:54 79023145535 1
#SMS_3dbiz 2015-11-11 19:29:54 79282702072 1
start send sms 11.11.2015 19:30:04 from newlp2 pages 
#SMS_newlp2 2015-11-11 19:29:54 +79851987722 1
#SMS_newlp2 2015-11-11 19:29:54 +7 915 523 1024 1
#SMS_newlp2 2015-11-11 19:29:54 +79294114124 1
#SMS_newlp2 2015-11-11 19:29:55 +7(918)3173767 1
#SMS_newlp2 2015-11-11 19:29:55 +79082330853 1
#SMS_newlp2  +790 517
#SMS_newlp2 2015-11-11 19:29:55 +380674839564 1
start send sms 12.11.2015 14:15:45 from onair pages (FOR TODAY) 
#SMS_3dbizToday 2015-11-12 14:15:34 77784593232 1
start send sms 12.11.2015 14:15:46 from onair pages 
#SMS_3dbiz  666666666666 517
#SMS_3dbiz 2015-11-12 14:15:35 79226573742 1
#SMS_3dbiz 2015-11-12 14:15:35 89037860882 1
#SMS_3dbiz 2015-11-12 14:15:35 998909964086 1
#SMS_3dbiz 2015-11-12 14:15:35 89293190555 1
#SMS_3dbiz 2015-11-12 14:15:35 89609150121 1
#SMS_3dbiz 2015-11-12 14:15:36 79061302869 1
#SMS_3dbiz 2015-11-12 14:15:36 998909574352 1
#SMS_3dbiz 2015-11-12 14:15:36 79097782908 1
#SMS_3dbiz 2015-11-12 14:15:36 79651355593 1
#SMS_3dbiz 2015-11-12 14:15:36 79663352727 1
#SMS_3dbiz 2015-11-12 14:15:37 79159807074 1
#SMS_3dbiz 2015-11-12 14:15:37 998901887786 1
#SMS_3dbiz 2015-11-12 14:15:37 79003080284 1
#SMS_3dbiz 2015-11-12 14:15:37 79253398229 1
#SMS_3dbiz 2015-11-12 14:15:37 79380291010 1
#SMS_3dbiz 2015-11-12 14:15:38 89857798912 1
#SMS_3dbiz 2015-11-12 14:15:38 89081278246 1
#SMS_3dbiz 2015-11-12 14:15:38 89884028578 1
#SMS_3dbiz 2015-11-12 14:15:38 9169161719 1
#SMS_3dbiz 2015-11-12 14:15:38 79200002078 1
#SMS_3dbiz 2015-11-12 14:15:39 89110747190 1
#SMS_3dbiz 2015-11-12 14:15:39 79852221277 1
#SMS_3dbiz 2015-11-12 14:15:39 79616708398 1
#SMS_3dbiz 2015-11-12 14:15:39 79119554506 1
start send sms 12.11.2015 14:15:51 from newlp2 pages 
#SMS_newlp2 2015-11-12 14:15:39 +79188286416 1
#SMS_newlp2 2015-11-12 14:15:39 +79151164091 1
#SMS_newlp2 2015-11-12 14:15:40 8-903-786-08-82 1
#SMS_newlp2 2015-11-12 14:15:40 +7 985 156 60 97 1
#SMS_newlp2 2015-11-12 14:15:40 89609150121 1
#SMS_newlp2 2015-11-12 14:15:40 +79851408755 1
#SMS_newlp2 2015-11-12 14:15:40 +79851408755 1
#SMS_newlp2 2015-11-12 14:15:41 +79851408755 1
#SMS_newlp2 2015-11-12 14:15:41 89672882840 1
#SMS_newlp2 2015-11-12 14:15:41 +380635741547 1
#SMS_newlp2 2015-11-12 14:15:41 +79261555601 1
#SMS_newlp2 2015-11-12 14:15:41 +79852221277 1
#SMS_newlp2 2015-11-12 14:15:41 +79852221277 1
#SMS_newlp2 2015-11-12 14:15:42 +79852221277 1
#SMS_newlp2 2015-11-12 14:15:42 +79852221277 1
#SMS_newlp2 2015-11-12 14:15:42 +79852221277 1
#SMS_newlp2 2015-11-12 14:15:42 89874960212 1
start send sms 12.11.2015 19:30:01 from onair pages (FOR TODAY) 
start send sms 12.11.2015 19:30:01 from onair pages 
start send sms 12.11.2015 19:30:01 from newlp2 pages 
start send sms 13.11.2015 19:30:01 from onair pages (FOR TODAY) 
#SMS_3dbizToday 2015-11-13 19:29:47 79524857560 1
#SMS_3dbizToday 2015-11-13 19:29:47 79605077373 1
start send sms 13.11.2015 19:30:01 from onair pages 
#SMS_3dbiz 2015-11-13 19:29:47 79055263316 1
#SMS_3dbiz 2015-11-13 19:29:47 79265221525 1
#SMS_3dbiz 2015-11-13 19:29:47 79279450583 1
#SMS_3dbiz 2015-11-13 19:29:48 79031006761 1
#SMS_3dbiz 2015-11-13 19:29:48 79227488304 1
#SMS_3dbiz 2015-11-13 19:29:48 79226096690 1
#SMS_3dbiz 2015-11-13 19:29:48 79220621717 1
#SMS_3dbiz 2015-11-13 19:29:48 79242591415 1
#SMS_3dbiz 2015-11-13 19:29:49 79033680377 1
#SMS_3dbiz 2015-11-13 19:29:49 79168025691 1
#SMS_3dbiz 2015-11-13 19:29:49 79115834260 1
#SMS_3dbiz 2015-11-13 19:29:49 79277835238 1
#SMS_3dbiz 2015-11-13 19:29:50 89655084090 1
#SMS_3dbiz 2015-11-13 19:29:50 998909111917 1
#SMS_3dbiz 2015-11-13 19:29:50 79244566012 1
#SMS_3dbiz 2015-11-13 19:29:50 89110223123 1
#SMS_3dbiz 2015-11-13 19:29:50 79037503685 1
#SMS_3dbiz 2015-11-13 19:29:50 89163453414 1
#SMS_3dbiz 2015-11-13 19:29:51 79234094430 1
#SMS_3dbiz 2015-11-13 19:29:51 89090905610 1
#SMS_3dbiz 2015-11-13 19:29:51 79639038872 1
#SMS_3dbiz 2015-11-13 19:29:51 89041544820 1
start send sms 13.11.2015 19:30:05 from newlp2 pages 
#SMS_newlp2 2015-11-13 19:29:51 +79265221525 1
#SMS_newlp2 2015-11-13 19:29:51 +79279450583 1
#SMS_newlp2 2015-11-13 19:29:52 +77079445808 1
#SMS_newlp2 2015-11-13 19:29:52 +79880832290 1
#SMS_newlp2 2015-11-13 19:29:52 +998909111917 1
#SMS_newlp2  +99244566012 517
#SMS_newlp2 2015-11-13 19:29:53 +7 (909) 409-85-65 1
#SMS_newlp2 2015-11-13 19:29:53 +7 (909) 409-85-65 1
start send sms 14.11.2015 19:30:01 from onair pages (FOR TODAY) 
start send sms 14.11.2015 19:30:01 from onair pages 
#SMS_3dbiz 2015-11-14 19:29:45 89851493388 1
#SMS_3dbiz 2015-11-14 19:29:45 79217900022 1
#SMS_3dbiz 2015-11-14 19:29:45 79139850394 1
#SMS_3dbiz 2015-11-14 19:29:45 89135329823 1
#SMS_3dbiz 2015-11-14 19:29:45 79034016800 1
#SMS_3dbiz 2015-11-14 19:29:45 79056332444 1
#SMS_3dbiz 2015-11-14 19:29:46 79081233300 1
#SMS_3dbiz 2015-11-14 19:29:46 89167569627 1
#SMS_3dbiz 2015-11-14 19:29:46 89676426517 1
#SMS_3dbiz 2015-11-14 19:29:46 79031084043 1
#SMS_3dbiz 2015-11-14 19:29:46 79279388899 1
#SMS_3dbiz 2015-11-14 19:29:47 79129748494 1
#SMS_3dbiz 2015-11-14 19:29:47 79685528510 1
#SMS_3dbiz 2015-11-14 19:29:47 79289008161 1
#SMS_3dbiz  998914541041 517
#SMS_3dbiz 2015-11-14 19:29:47 79261703370 1
#SMS_3dbiz 2015-11-14 19:29:47 79124581374 1
#SMS_3dbiz 2015-11-14 19:29:48 89388909142 1
start send sms 14.11.2015 19:30:04 from newlp2 pages 
#SMS_newlp2 2015-11-14 19:29:48 +7 919 517 80 59 1
#SMS_newlp2 2015-11-14 19:29:48 +79217900022 1
#SMS_newlp2 2015-11-14 19:29:48 +7(920)1610321 1
#SMS_newlp2 2015-11-14 19:29:48 +79162001056 1
#SMS_newlp2 2015-11-14 19:29:49 +79113741394 1
#SMS_newlp2 2015-11-14 19:29:49 +79056332444 1
#SMS_newlp2 2015-11-14 19:29:49 89002206327 1
#SMS_newlp2 2015-11-14 19:29:49 +79279388899 1
#SMS_newlp2 2015-11-14 19:29:49 +79065187700 1
#SMS_newlp2 2015-11-14 19:29:49 89388909142 1
start send sms 15.11.2015 19:30:01 from onair pages (FOR TODAY) 
#SMS_3dbizToday 2015-11-15 19:29:42 79162171535 1
#SMS_3dbizToday 2015-11-15 19:29:43 79123539194 1
#SMS_3dbizToday 2015-11-15 19:29:43 89370664703 1
#SMS_3dbizToday 2015-11-15 19:29:43 89066490140 1
start send sms 15.11.2015 19:30:02 from onair pages 
#SMS_3dbiz 2015-11-15 19:29:43 79163249504 1
#SMS_3dbiz 2015-11-15 19:29:43 79143152273 1
#SMS_3dbiz 2015-11-15 19:29:44 79538701437 1
#SMS_3dbiz  76578888776878 517
#SMS_3dbiz 2015-11-15 19:29:44 79131781413 1
#SMS_3dbiz 2015-11-15 19:29:44 79262876898 1
#SMS_3dbiz 2015-11-15 19:29:44 79301197989 1
#SMS_3dbiz 2015-11-15 19:29:44 79184040332 1
#SMS_3dbiz 2015-11-15 19:29:45 380501744398 1
#SMS_3dbiz 2015-11-15 19:29:45 89144465020 1
#SMS_3dbiz 2015-11-15 19:29:45 89670419818 1
#SMS_3dbiz 2015-11-15 19:29:45 79218568484 1
#SMS_3dbiz 2015-11-15 19:29:45 79055039530 1
#SMS_3dbiz 2015-11-15 19:29:46 79148404360 1
#SMS_3dbiz 2015-11-15 19:29:46 89094090632 1
#SMS_3dbiz 2015-11-15 19:29:46 9680981191 1
#SMS_3dbiz 2015-11-15 19:29:46 89531124526 1
start send sms 15.11.2015 19:30:05 from newlp2 pages 
#SMS_newlp2 2015-11-15 19:29:46 89262162429 1
#SMS_newlp2  0134651373 517
#SMS_newlp2 2015-11-15 19:29:47 89670419818 1
#SMS_newlp2 2015-11-15 19:29:47 79162593745 1
#SMS_newlp2 2015-11-15 19:29:47 89515859307 1
#SMS_newlp2 2015-11-15 19:29:47 +79148404360 1
#SMS_newlp2 2015-11-15 19:29:47 +79148404360 1
#SMS_newlp2 2015-11-15 19:29:47 +79148404360 1
#SMS_newlp2 2015-11-15 19:29:48 +79148404360 1
#SMS_newlp2 2015-11-15 19:29:48 +79148404360 1
#SMS_newlp2 2015-11-15 19:29:48 +79148404360 1
#SMS_newlp2 2015-11-15 19:29:48 +79620835487 1
#SMS_newlp2 2015-11-15 19:29:48 +79213572307 1
#SMS_newlp2 2015-11-15 19:29:49 +79247576278 1
#SMS_newlp2 2015-11-15 19:29:49 +79247576278 1
start send sms 16.11.2015 19:30:01 from onair pages (FOR TODAY) 
#SMS_3dbizToday 2015-11-16 19:29:40 89255810949 1
#SMS_3dbizToday 2015-11-16 19:29:41 380674066369 1
#SMS_3dbizToday 2015-11-16 19:29:41 79111654176 1
start send sms 16.11.2015 19:30:02 from onair pages 
#SMS_3dbiz 2015-11-16 19:29:41 79194659697 1
#SMS_3dbiz 2015-11-16 19:29:41 79097505405 1
#SMS_3dbiz 2015-11-16 19:29:41 79062186067 1
#SMS_3dbiz 2015-11-16 19:29:42 79374852850 1
#SMS_3dbiz 2015-11-16 19:29:42 79513832166 1
#SMS_3dbiz 2015-11-16 19:29:42 79198749619 1
#SMS_3dbiz 2015-11-16 19:29:42 89214673901 1
#SMS_3dbiz 2015-11-16 19:29:42 79042701228 1
#SMS_3dbiz 2015-11-16 19:29:42 79177970539 1
#SMS_3dbiz 2015-11-16 19:29:43 79097505405 1
#SMS_3dbiz 2015-11-16 19:29:43 905386209797 1
#SMS_3dbiz 2015-11-16 19:29:43 79057438661 1
#SMS_3dbiz 2015-11-16 19:29:43 89031235901 1
#SMS_3dbiz 2015-11-16 19:29:44 79802504053 1
#SMS_3dbiz 2015-11-16 19:29:44 9169482149 1
#SMS_3dbiz 2015-11-16 19:29:44 79688464232 1
#SMS_3dbiz 2015-11-16 19:29:44 79874230724 1
#SMS_3dbiz 2015-11-16 19:29:44 79614043320 1
#SMS_3dbiz 2015-11-16 19:29:44 79039719644 1
#SMS_3dbiz 2015-11-16 19:29:45 79031714854 1
#SMS_3dbiz 2015-11-16 19:29:45 79037496958 1
#SMS_3dbiz 2015-11-16 19:29:45 89263223474 1
#SMS_3dbiz 2015-11-16 19:29:45 89128277435 1
#SMS_3dbiz 2015-11-16 19:29:45 79872595861 1
#SMS_3dbiz 2015-11-16 19:29:45 79522807680 1
#SMS_3dbiz 2015-11-16 19:29:46 89281828540 1
#SMS_3dbiz 2015-11-16 19:29:46 89281828540 1
#SMS_3dbiz 2015-11-16 19:29:46 79175238178 1
#SMS_3dbiz 2015-11-16 19:29:46 89620026431 1
start send sms 16.11.2015 19:30:07 from newlp2 pages 
#SMS_newlp2 2015-11-16 19:29:46 +7 (916) 217 15 35 1
#SMS_newlp2 2015-11-16 19:29:46 9161803753 1
#SMS_newlp2 2015-11-16 19:29:47 +7(913)7059950 1
#SMS_newlp2 2015-11-16 19:29:47 +79514134880 1
#SMS_newlp2 2015-11-16 19:29:47 +79870607508 1
#SMS_newlp2 2015-11-16 19:29:47 +79042701228 1
#SMS_newlp2 2015-11-16 19:29:47 +79138291720 1
#SMS_newlp2 2015-11-16 19:29:47 +79202405161 1
#SMS_newlp2 2015-11-16 19:29:48 +79111376854 1
#SMS_newlp2 2015-11-16 19:29:48 +7(953)6662004 1
start send sms 17.11.2015 19:30:01 from onair pages (FOR TODAY) 
#SMS_3dbizToday  998933280088 517
start send sms 17.11.2015 19:30:01 from onair pages 
#SMS_3dbiz 2015-11-17 19:29:38 89645714788 1
#SMS_3dbiz 2015-11-17 19:29:39 37378814785 1
#SMS_3dbiz 2015-11-17 19:29:39 89274277784 1
#SMS_3dbiz 2015-11-17 19:29:40 79613156438 1
#SMS_3dbiz 2015-11-17 19:29:40 79084533506 1
#SMS_3dbiz 2015-11-17 19:29:40 79035080749 1
#SMS_3dbiz  957152382 517
#SMS_3dbiz 2015-11-17 19:29:40 79852704389 1
#SMS_3dbiz 2015-11-17 19:29:41 79611652365 1
#SMS_3dbiz 2015-11-17 19:29:41 79165872932 1
#SMS_3dbiz 2015-11-17 19:29:41 79176611414 1
#SMS_3dbiz 2015-11-17 19:29:41 89118233532 1
#SMS_3dbiz 2015-11-17 19:29:42 79172923367 1
#SMS_3dbiz 2015-11-17 19:29:42 89296349489 1
#SMS_3dbiz 2015-11-17 19:29:42 79262967942 1
#SMS_3dbiz 2015-11-17 19:29:42 79684633867 1
#SMS_3dbiz 2015-11-17 19:29:43 79273933919 1
#SMS_3dbiz 2015-11-17 19:29:43 79262786306 1
#SMS_3dbiz 2015-11-17 19:29:43 89254004452 1
#SMS_3dbiz 2015-11-17 19:29:43 79184093736 1
#SMS_3dbiz 2015-11-17 19:29:43 79153103616 1
#SMS_3dbiz 2015-11-17 19:29:43 79046356505 1
#SMS_3dbiz 2015-11-17 19:29:44 79689175767 1
start send sms 17.11.2015 19:30:07 from newlp2 pages 
#SMS_newlp2 2015-11-17 19:29:44 89636214439 1
#SMS_newlp2 2015-11-17 19:29:44 +380674066369 1
#SMS_newlp2 2015-11-17 19:29:44 +79613156438 1
#SMS_newlp2 2015-11-17 19:29:45 +7 (921) 406-49-96 1
#SMS_newlp2 2015-11-17 19:29:45 +7(917)6611414 1
#SMS_newlp2 2015-11-17 19:29:45 89269637329 1
#SMS_newlp2  89032088864 516
#SMS_newlp2  +79292216886 516
#SMS_newlp2  89174055817 516
start send sms 18.11.2015 19:30:01 from onair pages (FOR TODAY) 
#SMS_3dbizToday 2015-11-18 19:29:37 89092362305 1
#SMS_3dbizToday 2015-11-18 19:29:37 994556247089 1
#SMS_3dbizToday 2015-11-18 19:29:37 79163290373 1
#SMS_3dbizToday 2015-11-18 19:29:38 89224147025 1
start send sms 18.11.2015 19:30:03 from onair pages 
#SMS_3dbiz 2015-11-18 19:29:38 79112222025 1
#SMS_3dbiz 2015-11-18 19:29:38 79112222025 1
#SMS_3dbiz 2015-11-18 19:29:38 89689263018 1
#SMS_3dbiz 2015-11-18 19:29:38 79273309883 1
#SMS_3dbiz 2015-11-18 19:29:39 89282263175 1
#SMS_3dbiz  998933280088 517
#SMS_3dbiz 2015-11-18 19:29:39 89247912294 1
#SMS_3dbiz 2015-11-18 19:29:39 79653167416 1
#SMS_3dbiz 2015-11-18 19:29:39 79200002078 1
#SMS_3dbiz 2015-11-18 19:29:39 89152456820 1
#SMS_3dbiz 2015-11-18 19:29:40 89118555755 1
#SMS_3dbiz 2015-11-18 19:29:40 79244534398 1
#SMS_3dbiz 2015-11-18 19:29:40 79244534398 1
#SMS_3dbiz 2015-11-18 19:29:40 79284506393 1
#SMS_3dbiz 2015-11-18 19:29:41 79035020808 1
#SMS_3dbiz 2015-11-18 19:29:41 994556247089 1
#SMS_3dbiz 2015-11-18 19:29:41 79067560340 1
start send sms 18.11.2015 19:30:06 from newlp2 pages 
#SMS_newlp2 2015-11-18 19:29:41 +79117811904 1
#SMS_newlp2 2015-11-18 19:29:41 +79025783729 1
#SMS_newlp2 2015-11-18 19:29:42 +79626794468 1
#SMS_newlp2 2015-11-18 19:29:42 +79626794468 1
#SMS_newlp2 2015-11-18 19:29:42 89108916595 1
#SMS_newlp2 2015-11-18 19:29:42 +77021891029 1
#SMS_newlp2 2015-11-18 19:29:42 +79826741676 1
#SMS_newlp2 2015-11-18 19:29:43 +79273309883 1
#SMS_newlp2  +7 (956) 8360858 517
#SMS_newlp2 2015-11-18 19:29:43 +79252017525 1
#SMS_newlp2 2015-11-18 19:29:43 79059761550 1
#SMS_newlp2 2015-11-18 19:29:43 +79166478653 1
#SMS_newlp2 2015-11-18 19:29:44 +79646302730 1
start send sms 19.11.2015 19:30:01 from onair pages (FOR TODAY) 
#SMS_3dbizToday 2015-11-19 19:29:34 9821139646 1
#SMS_3dbizToday 2015-11-19 19:29:34 89855135132 1
start send sms 19.11.2015 19:30:02 from onair pages 
#SMS_3dbiz 2015-11-19 19:29:35 89616980030 1
#SMS_3dbiz 2015-11-19 19:29:35 79688241122 1
#SMS_3dbiz 2015-11-19 19:29:35 79052048007 1
#SMS_3dbiz 2015-11-19 19:29:35 79852777894 1
#SMS_3dbiz 2015-11-19 19:29:35 79173698490 1
#SMS_3dbiz 2015-11-19 19:29:35 994556007080 1
#SMS_3dbiz 2015-11-19 19:29:36 89288142314 1
#SMS_3dbiz 2015-11-19 19:29:36 79226102114 1
#SMS_3dbiz 2015-11-19 19:29:36 79048444731 1
#SMS_3dbiz 2015-11-19 19:29:36 79036689956 1
#SMS_3dbiz 2015-11-19 19:29:36 89048217967 1
#SMS_3dbiz  995598494966 517
#SMS_3dbiz 2015-11-19 19:29:37 79258858346 1
#SMS_3dbiz 2015-11-19 19:29:37 79295419773 1
#SMS_3dbiz 2015-11-19 19:29:38 89629790965 1
#SMS_3dbiz 2015-11-19 19:29:38 79533577231 1
start send sms 19.11.2015 19:30:05 from newlp2 pages 
#SMS_newlp2 2015-11-19 19:29:38 89688241122 1
#SMS_newlp2 2015-11-19 19:29:38 +79161828889 1
#SMS_newlp2 2015-11-19 19:29:39 +79261703370 1
#SMS_newlp2 2015-11-19 19:29:39 79152386710 1
#SMS_newlp2 2015-11-19 19:29:40 +79226102114 1
#SMS_newlp2 2015-11-19 19:29:40 +79036638257 1
#SMS_newlp2 2015-11-19 19:29:40 89857798912 1
#SMS_newlp2 2015-11-19 19:29:40 +371 29744025 1
#SMS_newlp2 2015-11-19 19:29:40 89000852141 1
#SMS_newlp2 2015-11-19 19:29:40 89604538088 1
start send sms 20.11.2015 19:30:01 from onair pages (FOR TODAY) 
#SMS_3dbizToday 2015-11-20 19:29:32 79005748132 1
#SMS_3dbizToday 2015-11-20 19:29:32 79521369498 1
#SMS_3dbizToday 2015-11-20 19:29:32 89373612574 1
start send sms 20.11.2015 19:30:02 from onair pages 
#SMS_3dbiz  50 517
#SMS_3dbiz 2015-11-20 19:29:33 79252211525 1
#SMS_3dbiz 2015-11-20 19:29:33 79803059904 1
#SMS_3dbiz 2015-11-20 19:29:33 79879704950 1
#SMS_3dbiz 2015-11-20 19:29:33 79052799074 1
#SMS_3dbiz 2015-11-20 19:29:33 79853883027 1
#SMS_3dbiz 2015-11-20 19:29:34 79181110545 1
#SMS_3dbiz 2015-11-20 19:29:34 79158290936 1
#SMS_3dbiz 2015-11-20 19:29:34 89859855857 1
#SMS_3dbiz 2015-11-20 19:29:34 375293973379 1
#SMS_3dbiz 2015-11-20 19:29:34 79287006800 1
#SMS_3dbiz 2015-11-20 19:29:34 89774729053 1
#SMS_3dbiz 2015-11-20 19:29:35 89023760196 1
#SMS_3dbiz 2015-11-20 19:29:35 79062377518 1
#SMS_3dbiz 2015-11-20 19:29:35 79381228736 1
#SMS_3dbiz 2015-11-20 19:29:35 79263411815 1
start send sms 20.11.2015 19:30:04 from newlp2 pages 
#SMS_newlp2 2015-11-20 19:29:35 +79003084636 1
#SMS_newlp2 2015-11-20 19:29:35 +79277702237 1
#SMS_newlp2 2015-11-20 19:29:36 +79138205599 1
#SMS_newlp2 2015-11-20 19:29:36 +7(981)8485438 1
#SMS_newlp2 2015-11-20 19:29:36 +79115032160 1
#SMS_newlp2 2015-11-20 19:29:36 +79853883027 1
#SMS_newlp2 2015-11-20 19:29:37 89631804953 1
#SMS_newlp2 2015-11-20 19:29:37 +79106088663 1
#SMS_newlp2 2015-11-20 19:29:37 +79097691297 1
#SMS_newlp2  +9940555064861 517
start send sms 21.11.2015 19:30:01 from onair pages (FOR TODAY) 
#SMS_3dbizToday 2015-11-21 19:29:30 79266398214 1
#SMS_3dbizToday 2015-11-21 19:29:30 79253413338 1
#SMS_3dbizToday 2015-11-21 19:29:30 380999775716 1
start send sms 21.11.2015 19:30:02 from onair pages 
#SMS_3dbiz 2015-11-21 19:29:30 79261890931 1
#SMS_3dbiz 2015-11-21 19:29:31 79197007793 1
#SMS_3dbiz 2015-11-21 19:29:31 79128143401 1
#SMS_3dbiz 2015-11-21 19:29:31 79022794574 1
#SMS_3dbiz 2015-11-21 19:29:32 89198749619 1
#SMS_3dbiz 2015-11-21 19:29:32 79095881433 1
#SMS_3dbiz 2015-11-21 19:29:33 79260308835 1
#SMS_3dbiz 2015-11-21 19:29:33 79150038909 1
#SMS_3dbiz 2015-11-21 19:29:33 9161446835 1
#SMS_3dbiz 2015-11-21 19:29:33 79629971129 1
#SMS_3dbiz 2015-11-21 19:29:33 89064470004 1
#SMS_3dbiz 2015-11-21 19:29:33 89210776323 1
#SMS_3dbiz 2015-11-21 19:29:34 79046964974 1
#SMS_3dbiz 2015-11-21 19:29:34 89518526048 1
#SMS_3dbiz 2015-11-21 19:29:34 89151313047 1
#SMS_3dbiz 2015-11-21 19:29:34 89197790183 1
#SMS_3dbiz 2015-11-21 19:29:34 79639224343 1
#SMS_3dbiz 2015-11-21 19:29:35 79104560589 1
#SMS_3dbiz 2015-11-21 19:29:35 89268436551 1
start send sms 21.11.2015 19:30:06 from newlp2 pages 
#SMS_newlp2 2015-11-21 19:29:35 +79110223123 1
#SMS_newlp2 2015-11-21 19:29:35 +79200601888 1
#SMS_newlp2 2015-11-21 19:29:35 +79232313330 1
#SMS_newlp2 2015-11-21 19:29:35 89064470004 1
#SMS_newlp2 2015-11-21 19:29:36 +79113336777 1
#SMS_newlp2 2015-11-21 19:29:36 +380638991260 1
#SMS_newlp2 2015-11-21 19:29:36 +79639224343 1
#SMS_newlp2 2015-11-21 19:29:36 +79005748132 1
#SMS_newlp2 2015-11-21 19:29:36 +79039719644 1
#SMS_newlp2 2015-11-21 19:29:36 +7 (913) 369 1910 1
#SMS_newlp2 2015-11-21 19:29:36 +79104560589 1
start send sms 22.11.2015 19:30:01 from onair pages (FOR TODAY) 
#SMS_3dbizToday 2015-11-22 19:29:28 79151233244 1
#SMS_3dbizToday  37256656217 517
#SMS_3dbizToday 2015-11-22 19:29:28 77053554841 1
#SMS_3dbizToday 2015-11-22 19:29:28 89530054707 1
#SMS_3dbizToday 2015-11-22 19:29:28 89289092280 1
#SMS_3dbizToday 2015-11-22 19:29:29 79854246189 1
#SMS_3dbizToday 2015-11-22 19:29:29 79264768556 1
start send sms 22.11.2015 19:30:02 from onair pages 
#SMS_3dbiz 2015-11-22 19:29:29 79152423240 1
#SMS_3dbiz 2015-11-22 19:29:29 79193083749 1
#SMS_3dbiz 2015-11-22 19:29:29 89687431239 1
#SMS_3dbiz 2015-11-22 19:29:30 79293640550 1
#SMS_3dbiz 2015-11-22 19:29:30 79222138671 1
#SMS_3dbiz 2015-11-22 19:29:30 79511933145 1
#SMS_3dbiz 2015-11-22 19:29:30 9896578624 1
#SMS_3dbiz 2015-11-22 19:29:30 79033164464 1
#SMS_3dbiz 2015-11-22 19:29:30 9137526601 1
#SMS_3dbiz 2015-11-22 19:29:31 79656126729 1
#SMS_3dbiz 2015-11-22 19:29:31 79168312027 1
start send sms 22.11.2015 19:30:05 from newlp2 pages 
#SMS_newlp2 2015-11-22 19:29:31 +79677566414 1
#SMS_newlp2 2015-11-22 19:29:31 +380983809331 1
#SMS_newlp2 2015-11-22 19:29:32 89504291846 1
You have an error in your SQL syntax; check the manual that corresponds to your MySQL server version for the right syntax to use near ' 0)' at line 1
start send sms 23.11.2015 19:30:01 from onair pages (FOR TODAY) 
#SMS_3dbizToday 2015-11-23 19:29:25 89523703879 1
#SMS_3dbizToday 2015-11-23 19:29:26 89325571854 1
#SMS_3dbizToday 2015-11-23 19:29:26 994556007080 1
#SMS_3dbizToday 2015-11-23 19:29:26 89508068370 1
start send sms 23.11.2015 19:30:02 from onair pages 
#SMS_3dbiz 2015-11-23 19:29:26 89284444414 1
#SMS_3dbiz 2015-11-23 19:29:27 79251151200 1
#SMS_3dbiz 2015-11-23 19:29:27 79137364922 1
#SMS_3dbiz  791214 517
#SMS_3dbiz 2015-11-23 19:29:27 79043828678 1
#SMS_3dbiz 2015-11-23 19:29:27 89889986456 1
#SMS_3dbiz 2015-11-23 19:29:28 9123704220 1
#SMS_3dbiz 2015-11-23 19:29:28 89216474532 1
#SMS_3dbiz 2015-11-23 19:29:28 79308456413 1
#SMS_3dbiz 2015-11-23 19:29:28 79049769894 1
#SMS_3dbiz 2015-11-23 19:29:28 89530054707 1
#SMS_3dbiz 2015-11-23 19:29:28 79826417801 1
#SMS_3dbiz  998977768862 517
#SMS_3dbiz  8918856004 517
#SMS_3dbiz 2015-11-23 19:29:29 79270359640 1
#SMS_3dbiz  3532636072 517
#SMS_3dbiz 2015-11-23 19:29:30 79064912899 1
#SMS_3dbiz 2015-11-23 19:29:30 79064912899 1
#SMS_3dbiz 2015-11-23 19:29:30 89874950995 1
#SMS_3dbiz 2015-11-23 19:29:30 79037929333 1
#SMS_3dbiz 2015-11-23 19:29:30 79164483076 1
start send sms 23.11.2015 19:30:06 from newlp2 pages 
#SMS_newlp2 2015-11-23 19:29:31 +79213409076 1
#SMS_newlp2 2015-11-23 19:29:31 +79151233244 1
#SMS_newlp2 2015-11-23 19:29:31 79126465421 1
#SMS_newlp2 2015-11-23 19:29:31 89299924654 1
#SMS_newlp2 2015-11-23 19:29:31 89525161335 1
#SMS_newlp2 2015-11-23 19:29:31 +79519844820 1
#SMS_newlp2 2015-11-23 19:29:32 +79107886277 1
start send sms 24.11.2015 19:30:01 from onair pages (FOR TODAY) 
start send sms 24.11.2015 19:30:01 from onair pages 
#SMS_3dbiz 2015-11-24 19:29:23 79262466750 1
#SMS_3dbiz 2015-11-24 19:29:24 79270198356 1
#SMS_3dbiz 2015-11-24 19:29:24 79138956264 1
#SMS_3dbiz 2015-11-24 19:29:24 79222248379 1
#SMS_3dbiz 2015-11-24 19:29:24 37369682994 1
#SMS_3dbiz  995599570978 517
#SMS_3dbiz 2015-11-24 19:29:24 89035158189 1
#SMS_3dbiz 2015-11-24 19:29:25 79186225592 1
#SMS_3dbiz 2015-11-24 19:29:25 89219427936 1
#SMS_3dbiz 2015-11-24 19:29:25 79517749757 1
#SMS_3dbiz 2015-11-24 19:29:25 79270736608 1
#SMS_3dbiz 2015-11-24 19:29:25 79612067158 1
#SMS_3dbiz 2015-11-24 19:29:25 79533432475 1
#SMS_3dbiz 2015-11-24 19:29:26 79500386755 1
#SMS_3dbiz 2015-11-24 19:29:26 89111771590 1
#SMS_3dbiz 2015-11-24 19:29:26 79671393797 1
start send sms 24.11.2015 19:30:04 from newlp2 pages 
#SMS_newlp2 2015-11-24 19:29:26 +79152795869 1
#SMS_newlp2 2015-11-24 19:29:26 +79130049716 1
#SMS_newlp2 2015-11-24 19:29:26 +79282904426 1
#SMS_newlp2 2015-11-24 19:29:27 89504291846 1
start send sms 25.11.2015 19:30:01 from onair pages (FOR TODAY) 
#SMS_3dbizToday 2015-11-25 19:29:22 79136742497 1
#SMS_3dbizToday 2015-11-25 19:29:22 79834113889 1
#SMS_3dbizToday 2015-11-25 19:29:22 89035043666 1
#SMS_3dbizToday 2015-11-25 19:29:23 89875794122 1
start send sms 25.11.2015 19:30:03 from onair pages 
#SMS_3dbiz 2015-11-25 19:29:23 380634169338 1
#SMS_3dbiz  972527500524 517
#SMS_3dbiz 2015-11-25 19:29:23 79129250135 1
#SMS_3dbiz 2015-11-25 19:29:23 79221415922 1
#SMS_3dbiz 2015-11-25 19:29:24 89028602060 1
#SMS_3dbiz  99365806224 517
#SMS_3dbiz  99365806224 517
#SMS_3dbiz  99365806224 517
#SMS_3dbiz 2015-11-25 19:29:25 79372972750 1
#SMS_3dbiz 2015-11-25 19:29:25 380661030347 1
#SMS_3dbiz 2015-11-25 19:29:25 79102361974 1
#SMS_3dbiz 2015-11-25 19:29:26 79268564317 1
#SMS_3dbiz 2015-11-25 19:29:27 89178882448 1
#SMS_3dbiz 2015-11-25 19:29:28 79251721738 1
#SMS_3dbiz 2015-11-25 19:29:28 37455077073 1
#SMS_3dbiz 2015-11-25 19:29:29 79127161235 1
start send sms 25.11.2015 19:30:09 from newlp2 pages 
#SMS_newlp2 2015-11-25 19:29:29 +79676122052 1
#SMS_newlp2 2015-11-25 19:29:29 +79221415922 1
#SMS_newlp2 2015-11-25 19:29:29 +79051532331 1
#SMS_newlp2 2015-11-25 19:29:30 +79268564317 1
#SMS_newlp2 2015-11-25 19:29:30 +79178882448 1
#SMS_newlp2 2015-11-25 19:29:30 +380682724141 1
#SMS_newlp2 2015-11-25 19:29:30 +7 (925) 172 17 38 1
start send sms 26.11.2015 19:30:01 from onair pages (FOR TODAY) 
#SMS_3dbizToday 2015-11-26 19:29:19 79265505424 1
start send sms 26.11.2015 19:30:02 from onair pages 
#SMS_3dbiz 2015-11-26 19:29:20 79639900063 1
#SMS_3dbiz 2015-11-26 19:29:20 79266273924 1
#SMS_3dbiz 2015-11-26 19:29:20 79145563932 1
#SMS_3dbiz 2015-11-26 19:29:20 79174040344 1
#SMS_3dbiz 2015-11-26 19:29:20 89176665357 1
#SMS_3dbiz 2015-11-26 19:29:21 79514964078 1
#SMS_3dbiz 2015-11-26 19:29:21 79519884055 1
#SMS_3dbiz 2015-11-26 19:29:21 79216348820 1
#SMS_3dbiz 2015-11-26 19:29:21 79855167000 1
#SMS_3dbiz 2015-11-26 19:29:21 79104246391 1
#SMS_3dbiz 2015-11-26 19:29:22 79510994442 1
#SMS_3dbiz 2015-11-26 19:29:22 79112170496 1
#SMS_3dbiz 2015-11-26 19:29:22 89267958677 1
#SMS_3dbiz  89 517
#SMS_3dbiz 2015-11-26 19:29:22 79780551892 1
#SMS_3dbiz 2015-11-26 19:29:23 37368449874 1
#SMS_3dbiz 2015-11-26 19:29:23 89265275510 1
start send sms 26.11.2015 19:30:05 from newlp2 pages 
#SMS_newlp2 2015-11-26 19:29:23 +7(921)984-38-56 1
#SMS_newlp2 2015-11-26 19:29:23 +79220337699 1
#SMS_newlp2 2015-11-26 19:29:23 +79167755055 1
#SMS_newlp2 2015-11-26 19:29:23 +79174040344 1
#SMS_newlp2 2015-11-26 19:29:24 +7 (9510) 99 44 42 1
#SMS_newlp2 2015-11-26 19:29:24 +79138820250 1
#SMS_newlp2 2015-11-26 19:29:24 +7(903) 971-96-44 1
start send sms 27.11.2015 19:30:01 from onair pages (FOR TODAY) 
start send sms 27.11.2015 19:30:01 from onair pages 
#SMS_3dbiz 2015-11-27 19:29:17 79118440432 1
#SMS_3dbiz 2015-11-27 19:29:18 79835083898 1
#SMS_3dbiz 2015-11-27 19:29:18 79644322883 1
#SMS_3dbiz 2015-11-27 19:29:18 9152484073 1
#SMS_3dbiz 2015-11-27 19:29:18 79237079107 1
#SMS_3dbiz 2015-11-27 19:29:19 79045466123 1
#SMS_3dbiz 2015-11-27 19:29:19 79167033310 1
#SMS_3dbiz 2015-11-27 19:29:19 79603838368 1
#SMS_3dbiz 2015-11-27 19:29:19 79193191909 1
#SMS_3dbiz 2015-11-27 19:29:19 79167826980 1
#SMS_3dbiz 2015-11-27 19:29:19 79199081266 1
#SMS_3dbiz 2015-11-27 19:29:20 79787478996 1
#SMS_3dbiz 2015-11-27 19:29:20 79055451870 1
#SMS_3dbiz 2015-11-27 19:29:20 89165114147 1
#SMS_3dbiz 2015-11-27 19:29:20 79139003524 1
#SMS_3dbiz 2015-11-27 19:29:20 380995679241 1
#SMS_3dbiz 2015-11-27 19:29:20 380995679241 1
#SMS_3dbiz 2015-11-27 19:29:21 79034720840 1
#SMS_3dbiz  18098 517
#SMS_3dbiz 2015-11-27 19:29:22 89262171693 1
#SMS_3dbiz 2015-11-27 19:29:22 89514787777 1
start send sms 27.11.2015 19:30:06 from newlp2 pages 
#SMS_newlp2  +99186372998 517
#SMS_newlp2 2015-11-27 19:29:22 +380665054704 1
#SMS_newlp2 2015-11-27 19:29:23 +7 9160831653 1
#SMS_newlp2 2015-11-27 19:29:23 +79265453803 1
start send sms 28.11.2015 19:30:01 from onair pages (FOR TODAY) 
#SMS_3dbizToday 2015-11-28 19:29:15 79164845705 1
start send sms 28.11.2015 19:30:02 from onair pages 
#SMS_3dbiz 2015-11-28 19:29:15 79122428368 1
#SMS_3dbiz 2015-11-28 19:29:16 79062867542 1
#SMS_3dbiz 2015-11-28 19:29:16 89262836322 1
#SMS_3dbiz 2015-11-28 19:29:16 89262836322 1
#SMS_3dbiz 2015-11-28 19:29:16 89262836322 1
#SMS_3dbiz 2015-11-28 19:29:16 79653480652 1
#SMS_3dbiz  37441887771 517
#SMS_3dbiz 2015-11-28 19:29:17 79034730031 1
#SMS_3dbiz 2015-11-28 19:29:17 79052740314 1
#SMS_3dbiz 2015-11-28 19:29:17 79041659637 1
#SMS_3dbiz 2015-11-28 19:29:17 89186471747 1
#SMS_3dbiz 2015-11-28 19:29:18 79182655011 1
#SMS_3dbiz 2015-11-28 19:29:18 79615994556 1
#SMS_3dbiz 2015-11-28 19:29:18 79635906818 1
#SMS_3dbiz 2015-11-28 19:29:18 79045530828 1
#SMS_3dbiz 2015-11-28 19:29:18 79267770601 1
#SMS_3dbiz 2015-11-28 19:29:18 89097408063 1
#SMS_3dbiz 2015-11-28 19:29:19 995555228278 1
start send sms 28.11.2015 19:30:05 from newlp2 pages 
#SMS_newlp2 2015-11-28 19:29:19 +79045530828 1
#SMS_newlp2 2015-11-28 19:29:19 +79062867542 1
#SMS_newlp2 2015-11-28 19:29:19 +7-904-165-96-37 1
#SMS_newlp2 2015-11-28 19:29:19 +79857227117 1
#SMS_newlp2 2015-11-28 19:29:19 +79032821736 1
#SMS_newlp2 2015-11-28 19:29:20 +79615994556 1
#SMS_newlp2 2015-11-28 19:29:20 +371 29744025 1
start send sms 29.11.2015 19:30:01 from onair pages (FOR TODAY) 
start send sms 29.11.2015 19:30:01 from onair pages 
#SMS_3dbiz 2015-11-29 19:29:13 79647728185 1
#SMS_3dbiz  972547979804 517
#SMS_3dbiz  972547979804 517
#SMS_3dbiz 2015-11-29 19:29:14 79372272207 1
#SMS_3dbiz 2015-11-29 19:29:14 79814564044 1
#SMS_3dbiz 2015-11-29 19:29:14 79138230630 1
#SMS_3dbiz 2015-11-29 19:29:15 79534298667 1
#SMS_3dbiz 2015-11-29 19:29:15 89097377978 1
#SMS_3dbiz 2015-11-29 19:29:15 79176763056 1
#SMS_3dbiz 2015-11-29 19:29:15 79780526659 1
#SMS_3dbiz 2015-11-29 19:29:15 79213174669 1
#SMS_3dbiz 2015-11-29 19:29:15 380509910555 1
#SMS_3dbiz 2015-11-29 19:29:16 79154588595 1
#SMS_3dbiz 2015-11-29 19:29:16 79518278433 1
#SMS_3dbiz 2015-11-29 19:29:16 79165714768 1
#SMS_3dbiz 2015-11-29 19:29:16 79161099127 1
#SMS_3dbiz 2015-11-29 19:29:16 79891327612 1
#SMS_3dbiz 2015-11-29 19:29:18 79891327612 1
#SMS_3dbiz  78565556655 517
#SMS_3dbiz 2015-11-29 19:29:18 89168654141 1
#SMS_3dbiz 2015-11-29 19:29:18 79095940580 1
#SMS_3dbiz  972547979804 517
#SMS_3dbiz 2015-11-29 19:29:18 79219050502 1
start send sms 29.11.2015 19:30:07 from newlp2 pages 
#SMS_newlp2  +(972)547979804 517
#SMS_newlp2  +(972)54-797-98-04 517
#SMS_newlp2 2015-11-29 19:29:20 +79528095713 1
#SMS_newlp2 2015-11-29 19:29:20 +79671393797 1
start send sms 30.11.2015 19:30:01 from onair pages (FOR TODAY) 
#SMS_3dbizToday 2015-11-30 19:29:11 79063305640 1
start send sms 30.11.2015 19:30:02 from onair pages 
#SMS_3dbiz 2015-11-30 19:29:11 89045035852 1
#SMS_3dbiz 2015-11-30 19:29:11 79645092212 1
#SMS_3dbiz 2015-11-30 19:29:11 79154791015 1
#SMS_3dbiz 2015-11-30 19:29:12 79148473028 1
#SMS_3dbiz 2015-11-30 19:29:12 89140560512 1
#SMS_3dbiz 2015-11-30 19:29:12 79057068392 1
#SMS_3dbiz 2015-11-30 19:29:12 79275218358 1
#SMS_3dbiz 2015-11-30 19:29:12 79371700586 1
#SMS_3dbiz 2015-11-30 19:29:13 79601126555 1
#SMS_3dbiz 2015-11-30 19:29:13 79605077373 1
#SMS_3dbiz 2015-11-30 19:29:13 79169045110 1
#SMS_3dbiz 2015-11-30 19:29:13 79250281739 1
#SMS_3dbiz 2015-11-30 19:29:13 79035158189 1
#SMS_3dbiz 2015-11-30 19:29:13 380635176802 1
start send sms 30.11.2015 19:30:04 from newlp2 pages 
#SMS_newlp2  +972547979804 517
#SMS_newlp2 2015-11-30 19:29:14 +79035158189 1
start send sms 01.12.2015 19:30:01 from onair pages (FOR TODAY) 
#SMS_3dbizToday 2015-12-01 19:29:08 79267824520 1
start send sms 01.12.2015 19:30:01 from onair pages 
#SMS_3dbiz 2015-12-01 19:29:09 79231149173 1
#SMS_3dbiz 2015-12-01 19:29:10 79231149173 1
#SMS_3dbiz 2015-12-01 19:29:10 89841059837 1
#SMS_3dbiz  864040010 517
#SMS_3dbiz 2015-12-01 19:29:10 79615994556 1
#SMS_3dbiz 2015-12-01 19:29:11 79161954442 1
#SMS_3dbiz 2015-12-01 19:29:11 79276084170 1
#SMS_3dbiz 2015-12-01 19:29:11 89226041309 1
#SMS_3dbiz 2015-12-01 19:29:11 79066994563 1
#SMS_3dbiz 2015-12-01 19:29:12 79151581821 1
#SMS_3dbiz 2015-12-01 19:29:12 79373694633 1
#SMS_3dbiz 2015-12-01 19:29:12 89031609572 1
#SMS_3dbiz 2015-12-01 19:29:12 89651569492 1
#SMS_3dbiz 2015-12-01 19:29:13 79153001200 1
#SMS_3dbiz 2015-12-01 19:29:13 89299398371 1
#SMS_3dbiz 2015-12-01 19:29:13 79130893531 1
#SMS_3dbiz 2015-12-01 19:29:13 89671182640 1
#SMS_3dbiz 2015-12-01 19:29:14 79151506550 1
start send sms 01.12.2015 19:30:06 from newlp2 pages 
#SMS_newlp2 2015-12-01 19:29:14 +79615994556 1
#SMS_newlp2 2015-12-01 19:29:14 89055603770 1
#SMS_newlp2 2015-12-01 19:29:14 89126465421 1
#SMS_newlp2 2015-12-01 19:29:14 +79066994563 1
#SMS_newlp2 2015-12-01 19:29:15 +79286854773 1
#SMS_newlp2 2015-12-01 19:29:15 89671182640 1
#SMS_newlp2 2015-12-01 19:29:15 +79672244355 1
start send sms 02.12.2015 19:30:01 from onair pages (FOR TODAY) 
#SMS_3dbizToday 2015-12-02 19:29:07 37495888511 1
#SMS_3dbizToday 2015-12-02 19:29:09 79186225597 1
#SMS_3dbizToday 2015-12-02 19:29:09 89157871915 1
start send sms 02.12.2015 19:30:04 from onair pages 
#SMS_3dbiz 2015-12-02 19:29:09 13108954081 1
#SMS_3dbiz 2015-12-02 19:29:09 380677553863 1
#SMS_3dbiz  998946188451 517
#SMS_3dbiz 2015-12-02 19:29:10 998903166447 1
#SMS_3dbiz 2015-12-02 19:29:11 89235524757 1
#SMS_3dbiz 2015-12-02 19:29:11 89133848050 1
#SMS_3dbiz 2015-12-02 19:29:11 89243284436 1
#SMS_3dbiz  675096432 517
#SMS_3dbiz  998935065451 517
#SMS_3dbiz  380442798528 517
#SMS_3dbiz 2015-12-02 19:29:12 79296025648 1
#SMS_3dbiz 2015-12-02 19:29:13 380931140995 1
#SMS_3dbiz  7916878750 517
#SMS_3dbiz 2015-12-02 19:29:13 380674839564 1
#SMS_3dbiz 2015-12-02 19:29:13 79161453135 1
#SMS_3dbiz 2015-12-02 19:29:13 79231079393 1
#SMS_3dbiz 2015-12-02 19:29:14 380678548941 1
#SMS_3dbiz 2015-12-02 19:29:14 905531004762 1
#SMS_3dbiz 2015-12-02 19:29:14 79181021431 1
#SMS_3dbiz 2015-12-02 19:29:14 380994875896 1
#SMS_3dbiz 2015-12-02 19:29:14 79897230901 1
start send sms 02.12.2015 19:30:09 from newlp2 pages 
#SMS_newlp2 2015-12-02 19:29:15 +380509950854 1
#SMS_newlp2 2015-12-02 19:29:15 89157871915 1
#SMS_newlp2 2015-12-02 19:29:15 +380677553863 1
#SMS_newlp2  +80671050322 517
#SMS_newlp2 2015-12-02 19:29:15 +7(985)7713699 1
#SMS_newlp2 2015-12-02 19:29:15 +380674839564 1
#SMS_newlp2 2015-12-02 19:29:16 +380678548941 1
#SMS_newlp2 2015-12-02 19:29:16 +7(963)722-54-52 1
#SMS_newlp2  + 510
start send sms 03.12.2015 19:30:01 from onair pages (FOR TODAY) 
#SMS_3dbizToday 2015-12-03 19:29:04 89131541937 1
start send sms 03.12.2015 19:30:01 from onair pages 
#SMS_3dbiz  713869685 517
#SMS_3dbiz 2015-12-03 19:29:05 79857217796 1
#SMS_3dbiz 2015-12-03 19:29:05 380665478963 1
#SMS_3dbiz 2015-12-03 19:29:05 995555471138 1
#SMS_3dbiz 2015-12-03 19:29:05 79162355088 1
#SMS_3dbiz 2015-12-03 19:29:05 380957696100 1
#SMS_3dbiz 2015-12-03 19:29:06 79620149204 1
#SMS_3dbiz 2015-12-03 19:29:06 89894559023 1
#SMS_3dbiz 2015-12-03 19:29:06 89278604664 1
#SMS_3dbiz  79 517
#SMS_3dbiz 2015-12-03 19:29:06 79186225592 1
#SMS_3dbiz 2015-12-03 19:29:06 89521183371 1
#SMS_3dbiz 2015-12-03 19:29:06 79877531121 1
#SMS_3dbiz 2015-12-03 19:29:07 79035042759 1
#SMS_3dbiz 2015-12-03 19:29:07 79039688533 1
#SMS_3dbiz 2015-12-03 19:29:07 79222252929 1
#SMS_3dbiz 2015-12-03 19:29:07 89251160260 1
#SMS_3dbiz 2015-12-03 19:29:07 89003721700 1
#SMS_3dbiz 2015-12-03 19:29:08 79166641333 1
#SMS_3dbiz 2015-12-03 19:29:08 380681334827 1
#SMS_3dbiz 2015-12-03 19:29:08 79852273464 1
#SMS_3dbiz 2015-12-03 19:29:08 79652233377 1
#SMS_3dbiz 2015-12-03 19:29:08 79652233377 1
#SMS_3dbiz 2015-12-03 19:29:08 79818897059 1
start send sms 03.12.2015 19:30:05 from newlp2 pages 
#SMS_newlp2 2015-12-03 19:29:09 +79501402879 1
#SMS_newlp2 2015-12-03 19:29:09 +7 985 7217796 1
#SMS_newlp2 2015-12-03 19:29:09 +7(916)1253196 1
#SMS_newlp2 2015-12-03 19:29:09 +79162355088 1
#SMS_newlp2 2015-12-03 19:29:09 +7-952-1183371 1
#SMS_newlp2  + 510
#SMS_newlp2 2015-12-03 19:29:10 +79174460281 1
#SMS_newlp2 2015-12-03 19:29:10 +79131541937 1
#SMS_newlp2 2015-12-03 19:29:10 +79041299912 1
#SMS_newlp2 2015-12-03 19:29:10 +7(919) 721-81-82 1
You have an error in your SQL syntax; check the manual that corresponds to your MySQL server version for the right syntax to use near ' 0)' at line 1
You have an error in your SQL syntax; check the manual that corresponds to your MySQL server version for the right syntax to use near ' 0)' at line 1
start send sms 04.12.2015 19:30:02 from onair pages (FOR TODAY) 
#SMS_3dbizToday 2015-12-04 19:29:03 380957696100 1
#SMS_3dbizToday 2015-12-04 19:29:05 380957696100 1
#SMS_3dbizToday  78955625320 517
#SMS_3dbizToday 2015-12-04 19:29:05 79181626262 1
#SMS_3dbizToday 2015-12-04 19:29:05 79186225592 1
#SMS_3dbizToday 2015-12-04 19:29:05 79186225592 1
#SMS_3dbizToday  71626265162 517
#SMS_3dbizToday  79846565462 517
#SMS_3dbizToday 2015-12-04 19:29:06 79186213535 1
#SMS_3dbizToday 2015-12-04 19:29:06 79181565656 1
#SMS_3dbizToday  23549870 517
#SMS_3dbizToday  34354354654654 517
#SMS_3dbizToday 2015-12-04 19:29:06 79061111111 1
#SMS_3dbizToday 2015-12-04 19:29:07 79056111111 1
#SMS_3dbizToday  3254657898 517
#SMS_3dbizToday  4654765 517
#SMS_3dbizToday  7456687986544 517
#SMS_3dbizToday 2015-12-04 19:29:07 79186225592 1
#SMS_3dbizToday 2015-12-04 19:29:07 89373612574 1
#SMS_3dbizToday 2015-12-04 19:29:08 89151462143 1
#SMS_3dbizToday 2015-12-04 19:29:08 79115091309 1
#SMS_3dbizToday 2015-12-04 19:29:08 79270431596 1
#SMS_3dbizToday 2015-12-04 19:29:08 79510520003 1
#SMS_3dbizToday 2015-12-04 19:29:08 79162304817 1
#SMS_3dbizToday 2015-12-04 19:29:09 79164847738 1
#SMS_3dbizToday 2015-12-04 19:29:09 89057663691 1
#SMS_3dbizToday 2015-12-04 19:29:09 79180273424 1
#SMS_3dbizToday 2015-12-04 19:29:09 77075169605 1
#SMS_3dbizToday 2015-12-04 19:29:09 380637655743 1
#SMS_3dbizToday 2015-12-04 19:29:09 79531730863 1
#SMS_3dbizToday 2015-12-04 19:29:10 79035929797 1
#SMS_3dbizToday 2015-12-04 19:29:10 79092144435 1
#SMS_3dbizToday 2015-12-04 19:29:10 79857815178 1
#SMS_3dbizToday 2015-12-04 19:29:10 79221529615 1
#SMS_3dbizToday 2015-12-04 19:29:10 380957696100 1
#SMS_3dbizToday 2015-12-04 19:29:11 79307701701 1
#SMS_3dbizToday 2015-12-04 19:29:11 79110924226 1
#SMS_3dbizToday 2015-12-04 19:29:11 89208841391 1
#SMS_3dbizToday 2015-12-04 19:29:11 79189195000 1
#SMS_3dbizToday 2015-12-04 19:29:11 89037946633 1
#SMS_3dbizToday 2015-12-04 19:29:11 994503164509 1
#SMS_3dbizToday 2015-12-04 19:29:12 79517596499 1
#SMS_3dbizToday 2015-12-04 19:29:12 79172850898 1
#SMS_3dbizToday 2015-12-04 19:29:12 79252761912 1
#SMS_3dbizToday 2015-12-04 19:29:12 79528980501 1
#SMS_3dbizToday 2015-12-04 19:29:12 996553043350 1
#SMS_3dbizToday 2015-12-04 19:29:12 380678417405 1
#SMS_3dbizToday 2015-12-04 19:29:13 79617793060 1
#SMS_3dbizToday 2015-12-04 19:29:13 79672488804 1
#SMS_3dbizToday 2015-12-04 19:29:13 79104000970 1
#SMS_3dbizToday 2015-12-04 19:29:13 89603526978 1
#SMS_3dbizToday 2015-12-04 19:29:13 79057964098 1
#SMS_3dbizToday  7901064722 517
#SMS_3dbizToday 2015-12-04 19:29:13 79522546461 1
#SMS_3dbizToday 2015-12-04 19:29:14 89509050021 1
#SMS_3dbizToday 2015-12-04 19:29:14 79271835855 1
#SMS_3dbizToday 2015-12-04 19:29:14 79134403345 1
#SMS_3dbizToday 2015-12-04 19:29:14 79153035430 1
#SMS_3dbizToday  380634359052380957843820 517
#SMS_3dbizToday 2015-12-04 19:29:14 79183733382 1
#SMS_3dbizToday 2015-12-04 19:29:15 79082052564 1
#SMS_3dbizToday 2015-12-04 19:29:15 13479823513 1
#SMS_3dbizToday 2015-12-04 19:29:15 89213990357 1
#SMS_3dbizToday 2015-12-04 19:29:15 89176150484 1
#SMS_3dbizToday 2015-12-04 19:29:15 79053820292 1
#SMS_3dbizToday 2015-12-04 19:29:16 79637723885 1
#SMS_3dbizToday 2015-12-04 19:29:16 89164578036 1
#SMS_3dbizToday 2015-12-04 19:29:16 79807062444 1
#SMS_3dbizToday 2015-12-04 19:29:16 89141503915 1
#SMS_3dbizToday 2015-12-04 19:29:16 79297429403 1
#SMS_3dbizToday 2015-12-04 19:29:16 79164747788 1
#SMS_3dbizToday  34671812557 517
#SMS_3dbizToday 2015-12-04 19:29:17 37129935837 1
#SMS_3dbizToday 2015-12-04 19:29:17 79117444796 1
#SMS_3dbizToday 2015-12-04 19:29:17 79507235323 1
#SMS_3dbizToday 2015-12-04 19:29:18 79788391114 1
#SMS_3dbizToday 2015-12-04 19:29:18 79872242768 1
#SMS_3dbizToday 2015-12-04 19:29:19 89116080047 1
#SMS_3dbizToday  780939491735 517
#SMS_3dbizToday  780939491735 517
#SMS_3dbizToday  7916217155 517
#SMS_3dbizToday 2015-12-04 19:29:19 79033079515 1
#SMS_3dbizToday 2015-12-04 19:29:19 79615994556 1
#SMS_3dbizToday 2015-12-04 19:29:20 79135702344 1
#SMS_3dbizToday 2015-12-04 19:29:20 79828148004 1
#SMS_3dbizToday 2015-12-04 19:29:20 87786854117 1
#SMS_3dbizToday 2015-12-04 19:29:20 9383321788 1
#SMS_3dbizToday 2015-12-04 19:29:20 79535888840 1
#SMS_3dbizToday 2015-12-04 19:29:21 380504033307 1
#SMS_3dbizToday 2015-12-04 19:29:21 89279615120 1
#SMS_3dbizToday 2015-12-04 19:29:21 79616069705 1
#SMS_3dbizToday 2015-12-04 19:29:21 79136399039 1
#SMS_3dbizToday  3452605520 517
#SMS_3dbizToday 2015-12-04 19:29:21 79178848750 1
#SMS_3dbizToday 2015-12-04 19:29:22 79207504977 1
#SMS_3dbizToday 2015-12-04 19:29:22 9033168671 1
#SMS_3dbizToday 2015-12-04 19:29:22 89151920923 1
#SMS_3dbizToday 2015-12-04 19:29:22 79284359330 1
#SMS_3dbizToday 2015-12-04 19:29:23 79050545571 1
#SMS_3dbizToday  939777718 517
#SMS_3dbizToday 2015-12-04 19:29:23 79045455317 1
#SMS_3dbizToday 2015-12-04 19:29:23 79113085156 1
#SMS_3dbizToday  84991534183 517
#SMS_3dbizToday 2015-12-04 19:29:23 79624034481 1
#SMS_3dbizToday 2015-12-04 19:29:24 77051082143 1
#SMS_3dbizToday 2015-12-04 19:29:24 79879700137 1
#SMS_3dbizToday 2015-12-04 19:29:24 77477000145 1
#SMS_3dbizToday 2015-12-04 19:29:24 79216184537 1
#SMS_3dbizToday 2015-12-04 19:29:24 79187502847 1
#SMS_3dbizToday 2015-12-04 19:29:24 89646208486 1
#SMS_3dbizToday 2015-12-04 19:29:25 79197007793 1
#SMS_3dbizToday 2015-12-04 19:29:25 79153293523 1
#SMS_3dbizToday  447803713047 517
#SMS_3dbizToday 2015-12-04 19:29:25 37369178204 1
#SMS_3dbizToday 2015-12-04 19:29:25 79654676284 1
#SMS_3dbizToday 2015-12-04 19:29:26 79175625348 1
#SMS_3dbizToday 2015-12-04 19:29:26 79203905255 1
#SMS_3dbizToday 2015-12-04 19:29:26 380979901441 1
#SMS_3dbizToday 2015-12-04 19:29:26 380983785970 1
#SMS_3dbizToday 2015-12-04 19:29:26 79858904061 1
#SMS_3dbizToday 2015-12-04 19:29:26 380638881040 1
#SMS_3dbizToday 2015-12-04 19:29:27 79656095833 1
#SMS_3dbizToday 2015-12-04 19:29:27 89831187015 1
#SMS_3dbizToday 2015-12-04 19:29:27 37379478487 1
start send sms 04.12.2015 19:30:26 from onair pages 
#SMS_3dbiz  71513513131351 517
#SMS_3dbiz 2015-12-04 19:29:27 79312305222 1
#SMS_3dbiz 2015-12-04 19:29:28 9068478721 1
#SMS_3dbiz 2015-12-04 19:29:28 79098610208 1
#SMS_3dbiz 2015-12-04 19:29:28 89826709702 1
#SMS_3dbiz  38114254445 517
#SMS_3dbiz 2015-12-04 19:29:28 9262093188 1
#SMS_3dbiz 2015-12-04 19:29:28 89600044275 1
#SMS_3dbiz 2015-12-04 19:29:29 89503493943 1
#SMS_3dbiz 2015-12-04 19:29:29 9266303156 1
#SMS_3dbiz  998977768862 517
#SMS_3dbiz 2015-12-04 19:29:29 79224254752 1
#SMS_3dbiz 2015-12-04 19:29:29 79063417291 1
#SMS_3dbiz 2015-12-04 19:29:29 79260577981 1
#SMS_3dbiz 2015-12-04 19:29:30 89163609026 1
#SMS_3dbiz 2015-12-04 19:29:30 380977048897 1
#SMS_3dbiz 2015-12-04 19:29:30 79381451500 1
#SMS_3dbiz 2015-12-04 19:29:30 380631003923 1
#SMS_3dbiz 2015-12-04 19:29:30 79217907515 1
#SMS_3dbiz 2015-12-04 19:29:31 89655974355 1
#SMS_3dbiz 2015-12-04 19:29:32 89251575142 1
#SMS_3dbiz 2015-12-04 19:29:32 79255458121 1
#SMS_3dbiz 2015-12-04 19:29:32 79219591910 1
#SMS_3dbiz 2015-12-04 19:29:32 79219591910 1
#SMS_3dbiz 2015-12-04 19:29:32 79611210060 1
#SMS_3dbiz 2015-12-04 19:29:32 79858746628 1
start send sms 04.12.2015 19:30:32 from newlp2 pages 
#SMS_newlp2 2015-12-04 19:29:33 89021971700 1
#SMS_newlp2 2015-12-04 19:29:33 89285442725 1
#SMS_newlp2 2015-12-04 19:29:33 +79267356896 1
#SMS_newlp2 2015-12-04 19:29:33 79999999999 1
#SMS_newlp2 2015-12-04 19:29:33 +79219591910 1
start send sms 05.12.2015 19:30:01 from onair pages (FOR TODAY) 
#SMS_3dbizToday 2015-12-05 19:29:01 37455077073 1
#SMS_3dbizToday 2015-12-05 19:29:01 79508555266 1
#SMS_3dbizToday 2015-12-05 19:29:01 89179217264 1
#SMS_3dbizToday 2015-12-05 19:29:01 79613718691 1
#SMS_3dbizToday 2015-12-05 19:29:01 79062375026 1
#SMS_3dbizToday 2015-12-05 19:29:02 380661764146 1
#SMS_3dbizToday 2015-12-05 19:29:02 79787073272 1
#SMS_3dbizToday 2015-12-05 19:29:02 375336017506 1
#SMS_3dbizToday 2015-12-05 19:29:02 79103783206 1
#SMS_3dbizToday 2015-12-05 19:29:03 79836257585 1
#SMS_3dbizToday 2015-12-05 19:29:03 79653248429 1
#SMS_3dbizToday 2015-12-05 19:29:03 87014877160 1
#SMS_3dbizToday 2015-12-05 19:29:03 79138307935 1
#SMS_3dbizToday 2015-12-05 19:29:03 79827544393 1
#SMS_3dbizToday 2015-12-05 19:29:04 79039637710 1
#SMS_3dbizToday 2015-12-05 19:29:04 79039637710 1
#SMS_3dbizToday 2015-12-05 19:29:04 89133195033 1
#SMS_3dbizToday  99365943331 517
#SMS_3dbizToday 2015-12-05 19:29:04 79507601248 1
#SMS_3dbizToday 2015-12-05 19:29:04 9119907275 1
#SMS_3dbizToday 2015-12-05 19:29:05 89612991921 1
#SMS_3dbizToday 2015-12-05 19:29:05 79128810544 1
#SMS_3dbizToday 2015-12-05 19:29:05 79615930178 1
#SMS_3dbizToday  73467572065 517
#SMS_3dbizToday 2015-12-05 19:29:05 380992622553 1
#SMS_3dbizToday 2015-12-05 19:29:05 89514519351 1
#SMS_3dbizToday  78213613830 517
#SMS_3dbizToday 2015-12-05 19:29:06 79637199640 1
#SMS_3dbizToday 2015-12-05 19:29:06 79628323337 1
#SMS_3dbizToday 2015-12-05 19:29:06 79136824885 1
#SMS_3dbizToday 2015-12-05 19:29:06 79023732399 1
#SMS_3dbizToday 2015-12-05 19:29:06 79235086401 1
#SMS_3dbizToday 2015-12-05 19:29:06 79110747190 1
#SMS_3dbizToday 2015-12-05 19:29:07 89531436485 1
#SMS_3dbizToday 2015-12-05 19:29:07 79501905470 1
#SMS_3dbizToday 2015-12-05 19:29:07 79521849018 1
#SMS_3dbizToday 2015-12-05 19:29:07 89288975854 1
#SMS_3dbizToday 2015-12-05 19:29:07 375333170643 1
#SMS_3dbizToday 2015-12-05 19:29:07 79286615526 1
#SMS_3dbizToday 2015-12-05 19:29:08 79088578542 1
#SMS_3dbizToday 2015-12-05 19:29:08 89833122209 1
#SMS_3dbizToday 2015-12-05 19:29:08 79094721178 1
#SMS_3dbizToday 2015-12-05 19:29:08 79258478870 1
start send sms 05.12.2015 19:30:10 from onair pages 
#SMS_3dbiz 2015-12-05 19:29:09 89134897696 1
#SMS_3dbiz 2015-12-05 19:29:09 380957696100 1
#SMS_3dbiz 2015-12-05 19:29:09 79099789159 1
#SMS_3dbiz 2015-12-05 19:29:09 89169411072 1
#SMS_3dbiz 2015-12-05 19:29:10 79277708279 1
#SMS_3dbiz 2015-12-05 19:29:10 89036679229 1
#SMS_3dbiz 2015-12-05 19:29:11 380503121111 1
#SMS_3dbiz 2015-12-05 19:29:11 79020051740 1
#SMS_3dbiz 2015-12-05 19:29:11 79034767071 1
#SMS_3dbiz 2015-12-05 19:29:12 89620775515 1
#SMS_3dbiz 2015-12-05 19:29:12 79126161551 1
#SMS_3dbiz  37377748112 517
#SMS_3dbiz 2015-12-05 19:29:12 79525818851 1
#SMS_3dbiz 2015-12-05 19:29:12 79138295933 1
#SMS_3dbiz 2015-12-05 19:29:13 79223625217 1
#SMS_3dbiz 2015-12-05 19:29:13 79626321396 1
#SMS_3dbiz 2015-12-05 19:29:13 79052697978 1
#SMS_3dbiz 2015-12-05 19:29:13 79289644383 1
#SMS_3dbiz 2015-12-05 19:29:13 79617619115 1
#SMS_3dbiz 2015-12-05 19:29:13 89039707320 1
#SMS_3dbiz 2015-12-05 19:29:14 79276920548 1
#SMS_3dbiz 2015-12-05 19:29:14 79004805188 1
#SMS_3dbiz 2015-12-05 19:29:14 79219284472 1
#SMS_3dbiz 2015-12-05 19:29:14 79282829851 1
#SMS_3dbiz 2015-12-05 19:29:14 79116064119 1
#SMS_3dbiz 2015-12-05 19:29:14 79067472236 1
#SMS_3dbiz 2015-12-05 19:29:15 79040910886 1
#SMS_3dbiz 2015-12-05 19:29:15 79222266188 1
#SMS_3dbiz 2015-12-05 19:29:15 79222266188 1
#SMS_3dbiz 2015-12-05 19:29:15 37368449874 1
#SMS_3dbiz 2015-12-05 19:29:15 79312843095 1
#SMS_3dbiz 2015-12-05 19:29:15 79312843095 1
#SMS_3dbiz 2015-12-05 19:29:16 79062396870 1
#SMS_3dbiz 2015-12-05 19:29:16 79807010627 1
#SMS_3dbiz 2015-12-05 19:29:16 89643948668 1
#SMS_3dbiz 2015-12-05 19:29:16 79645765677 1
start send sms 05.12.2015 19:30:18 from newlp2 pages 
#SMS_newlp2 2015-12-05 19:29:16 +380957696100 1
#SMS_newlp2  78955625320 517
#SMS_newlp2 2015-12-05 19:29:17 +79181626262 1
#SMS_newlp2 2015-12-05 19:29:17 +79186225592 1
#SMS_newlp2 2015-12-05 19:29:17 +79186225592 1
#SMS_newlp2  +71626265162 517
#SMS_newlp2  +79846565462 517
#SMS_newlp2 2015-12-05 19:29:18 +79186213535 1
#SMS_newlp2 2015-12-05 19:29:18 +79181565656 1
#SMS_newlp2  23549870 517
#SMS_newlp2  +34354354654654 517
#SMS_newlp2 2015-12-05 19:29:18 +7(906)111-11-11 1
#SMS_newlp2 2015-12-05 19:29:18 +7(905)6111111 1
#SMS_newlp2  regrtnghngh 510
#SMS_newlp2  +3254657898 517
#SMS_newlp2  +4654765 517
#SMS_newlp2  +7456687986544 517
#SMS_newlp2 2015-12-05 19:29:20 +79186225592 1
#SMS_newlp2 2015-12-05 19:29:20 89373612574 1
#SMS_newlp2 2015-12-05 19:29:20 89151462143 1
#SMS_newlp2 2015-12-05 19:29:21 +79115091309 1
#SMS_newlp2 2015-12-05 19:29:21 +79270431596 1
#SMS_newlp2 2015-12-05 19:29:21 +79510520003 1
#SMS_newlp2 2015-12-05 19:29:21 +7 (916) 2304817 1
#SMS_newlp2 2015-12-05 19:29:21 +79164847738 1
#SMS_newlp2 2015-12-05 19:29:22 89057663691 1
#SMS_newlp2 2015-12-05 19:29:22 +7 918 027 34 24 1
#SMS_newlp2 2015-12-05 19:29:22 +77075169605 1
#SMS_newlp2 2015-12-05 19:29:22 +380637655743 1
#SMS_newlp2 2015-12-05 19:29:22 +79531730863 1
#SMS_newlp2 2015-12-05 19:29:22 +7(903)5929797 1
#SMS_newlp2 2015-12-05 19:29:23 +79092144435 1
#SMS_newlp2 2015-12-05 19:29:23 +7 (985) 78-151-78 1
#SMS_newlp2 2015-12-05 19:29:23 +7(922)1529615 1
#SMS_newlp2 2015-12-05 19:29:23 +380957696100 1
#SMS_newlp2 2015-12-05 19:29:23 +79307701701  1
#SMS_newlp2 2015-12-05 19:29:23 +79110924226 1
#SMS_newlp2 2015-12-05 19:29:24 89208841391 1
#SMS_newlp2 2015-12-05 19:29:24 79189195000 1
#SMS_newlp2 2015-12-05 19:29:24 89037946633 1
#SMS_newlp2 2015-12-05 19:29:24 +99450 316 45 09 1
#SMS_newlp2 2015-12-05 19:29:24 +79517596499 1
#SMS_newlp2 2015-12-05 19:29:24 +7 (917) 285-08-98 1
#SMS_newlp2 2015-12-05 19:29:25 79252761912 1
#SMS_newlp2 2015-12-05 19:29:25 +79528980501 1
#SMS_newlp2 2015-12-05 19:29:25 +996553043350 1
#SMS_newlp2 2015-12-05 19:29:25 +380678417405 1
#SMS_newlp2 2015-12-05 19:29:25 +79617793060 1
#SMS_newlp2 2015-12-05 19:29:26 +79672488804 1
#SMS_newlp2 2015-12-05 19:29:26 +79104000970 1
#SMS_newlp2 2015-12-05 19:29:26 89603526978 1
#SMS_newlp2 2015-12-05 19:29:26 +79057964098 1
#SMS_newlp2  +7901064722 517
#SMS_newlp2 2015-12-05 19:29:28 +79522546461 1
#SMS_newlp2 2015-12-05 19:29:28 89509050021 1
#SMS_newlp2 2015-12-05 19:29:28 +79271835855 1
#SMS_newlp2 2015-12-05 19:29:29 +79134403345 1
#SMS_newlp2 2015-12-05 19:29:30 +79153035430 1
#SMS_newlp2 2015-12-05 19:29:30 +380634359052, +380957843820 1
#SMS_newlp2 2015-12-05 19:29:30 +79183733382 1
#SMS_newlp2 2015-12-05 19:29:30 +7 9082052564 1
#SMS_newlp2 2015-12-05 19:29:30 +13479823513 1
#SMS_newlp2 2015-12-05 19:29:30 89213990357 1
#SMS_newlp2 2015-12-05 19:29:31 89176150484 1
#SMS_newlp2 2015-12-05 19:29:31 +79053820292 1
#SMS_newlp2 2015-12-05 19:29:31 +7 (963)772-38-85 1
#SMS_newlp2 2015-12-05 19:29:31 8-916-457-80-36 1
#SMS_newlp2 2015-12-05 19:29:31 +79807062444 1
#SMS_newlp2 2015-12-05 19:29:31 89141503915 1
#SMS_newlp2 2015-12-05 19:29:32 +79297429403 1
#SMS_newlp2 2015-12-05 19:29:32 +79164747788 1
#SMS_newlp2  +34671812557 517
#SMS_newlp2 2015-12-05 19:29:32 +37129935837 1
#SMS_newlp2 2015-12-05 19:29:32 +79117444796 1
#SMS_newlp2 2015-12-05 19:29:32 +79507235323 1
#SMS_newlp2 2015-12-05 19:29:33 +79788391114 1
#SMS_newlp2 2015-12-05 19:29:33 +79872242768 1
#SMS_newlp2 2015-12-05 19:29:33 89116080047 1
#SMS_newlp2  +780939491735 517
#SMS_newlp2  +780939491735 517
#SMS_newlp2  +7 (916) 217-15-5 517
#SMS_newlp2 2015-12-05 19:29:34 +79033079515 1
#SMS_newlp2 2015-12-05 19:29:34 +79615994556 1
#SMS_newlp2 2015-12-05 19:29:34 +7 (913) 570-23-44 1
#SMS_newlp2 2015-12-05 19:29:35 +79828148004 1
#SMS_newlp2 2015-12-05 19:29:35 87786854117 1
#SMS_newlp2 2015-12-05 19:29:37 9383321788 1
#SMS_newlp2 2015-12-05 19:29:37 +79535888840 1
#SMS_newlp2 2015-12-05 19:29:37 +380504033307 1
#SMS_newlp2 2015-12-05 19:29:37 89279615120 1
#SMS_newlp2 2015-12-05 19:29:37 +79616069705 1
#SMS_newlp2 2015-12-05 19:29:37 +79136399039 1
#SMS_newlp2  3452605520 517
#SMS_newlp2 2015-12-05 19:29:38 +79178848750 1
#SMS_newlp2 2015-12-05 19:29:38 +7(920)7504977 1
#SMS_newlp2 2015-12-05 19:29:38 9033168671 1
#SMS_newlp2 2015-12-05 19:29:38 89151920923 1
#SMS_newlp2 2015-12-05 19:29:38 +79284359330 1
#SMS_newlp2 2015-12-05 19:29:39 +79050545571 1
#SMS_newlp2  0939777718 517
#SMS_newlp2 2015-12-05 19:29:39 +79045455317 1
#SMS_newlp2 2015-12-05 19:29:39 +7 (911) 308 51 56 1
#SMS_newlp2  84991534183 517
#SMS_newlp2 2015-12-05 19:29:39 +79624034481 1
#SMS_newlp2 2015-12-05 19:29:40 +77051082143 1
#SMS_newlp2 2015-12-05 19:29:40 +79879700137 1
#SMS_newlp2 2015-12-05 19:29:40 +7 747 700 0145 1
#SMS_newlp2 2015-12-05 19:29:40 +7(921)6184537 1
#SMS_newlp2 2015-12-05 19:29:40 +79187502847 1
#SMS_newlp2 2015-12-05 19:29:41 8 964 620 84 86 1
#SMS_newlp2 2015-12-05 19:29:41 +79197007793 1
#SMS_newlp2 2015-12-05 19:29:41 +7-915-329-35-23 1
#SMS_newlp2  +447803713047 517
#SMS_newlp2 2015-12-05 19:29:41 +37369178204 1
#SMS_newlp2 2015-12-05 19:29:41 +79654676284 1
#SMS_newlp2 2015-12-05 19:29:42 +7 (917) 562 53 48 1
#SMS_newlp2 2015-12-05 19:29:42 +79203905255 1
#SMS_newlp2 2015-12-05 19:29:42 +380979901441 1
#SMS_newlp2 2015-12-05 19:29:42 +380983785970 1
#SMS_newlp2 2015-12-05 19:29:42 +79858904061 1
#SMS_newlp2 2015-12-05 19:29:42 +380638881040 1
#SMS_newlp2 2015-12-05 19:29:43 +7(965)609 58 33 1
#SMS_newlp2 2015-12-05 19:29:43 89831187015 1
#SMS_newlp2 2015-12-05 19:29:43 +37379478487 1
#SMS_newlp2  0134651373 517
#SMS_newlp2 2015-12-05 19:29:43 89163214645 1
#SMS_newlp2 2015-12-05 19:29:43 +7 (903) 593 79 32 1
#SMS_newlp2 2015-12-05 19:29:44 89163291842 1
#SMS_newlp2 2015-12-05 19:29:44 +79263914628 1
#SMS_newlp2 2015-12-05 19:29:44 89818619683 1
#SMS_newlp2 2015-12-05 19:29:44 8 980 700 8400 1
#SMS_newlp2 2015-12-05 19:29:44 89620775515 1
#SMS_newlp2 2015-12-05 19:29:44 +7(912)6161551 1
#SMS_newlp2  +37377748112 517
#SMS_newlp2 2015-12-05 19:29:45 +79525818851 1
#SMS_newlp2 2015-12-05 19:29:45 +79223625217 1
#SMS_newlp2 2015-12-05 19:29:45 +79626321396 1
#SMS_newlp2 2015-12-05 19:29:45 +79052697978 1
#SMS_newlp2 2015-12-05 19:29:45 +79289644383 1
#SMS_newlp2 2015-12-05 19:29:46 +7(961)7619115 1
#SMS_newlp2 2015-12-05 19:29:46 +79276920548 1
#SMS_newlp2 2015-12-05 19:29:46 +7 9004805188 1
#SMS_newlp2 2015-12-05 19:29:46 +79219284472 1
#SMS_newlp2 2015-12-05 19:29:46 +7 928 282 98 51 1
#SMS_newlp2 2015-12-05 19:29:47 +7-911-606-41-19 1
#SMS_newlp2 2015-12-05 19:29:47 +79067472236 1
#SMS_newlp2 2015-12-05 19:29:47 +79040910886 1
#SMS_newlp2 2015-12-05 19:29:47 +79222266188 1
#SMS_newlp2 2015-12-05 19:29:47 +37368449874 1
#SMS_newlp2 2015-12-05 19:29:48 +79312843095 1
#SMS_newlp2 2015-12-05 19:29:48 +79312843095 1
#SMS_newlp2 2015-12-05 19:29:48 +7(906)2396870 1
#SMS_newlp2 2015-12-05 19:29:49 +7 980 701 0627 1
#SMS_newlp2 2015-12-05 19:29:49 8 964 3948668 1
#SMS_newlp2 2015-12-05 19:29:49 +79645765677 1
start send sms 06.12.2015 19:30:01 from onair pages (FOR TODAY) 
#SMS_3dbizToday 2015-12-06 19:28:58 79162326343 1
#SMS_3dbizToday 2015-12-06 19:28:58 79108071284 1
#SMS_3dbizToday  97523754825 517
#SMS_3dbizToday 2015-12-06 19:28:59 79275754563 1
#SMS_3dbizToday 2015-12-06 19:28:59 905322024912 1
#SMS_3dbizToday  95322024912 517
#SMS_3dbizToday 2015-12-06 19:28:59 89128346862 1
#SMS_3dbizToday 2015-12-06 19:29:00 998909999240 1
#SMS_3dbizToday 2015-12-06 19:29:00 79214352761 1
#SMS_3dbizToday 2015-12-06 19:29:00 79168287761 1
#SMS_3dbizToday 2015-12-06 19:29:00 79260282056 1
#SMS_3dbizToday 2015-12-06 19:29:00 79609615261 1
#SMS_3dbizToday 2015-12-06 19:29:00 79834693350 1
#SMS_3dbizToday 2015-12-06 19:29:01 89620775515 1
#SMS_3dbizToday 2015-12-06 19:29:01 77017282090 1
#SMS_3dbizToday 2015-12-06 19:29:01 79162171535 1
#SMS_3dbizToday 2015-12-06 19:29:01 79286630145 1
#SMS_3dbizToday 2015-12-06 19:29:01 79115461080 1
#SMS_3dbizToday 2015-12-06 19:29:02 79151976644 1
#SMS_3dbizToday 2015-12-06 19:29:03 79258478870 1
#SMS_3dbizToday 2015-12-06 19:29:03 79213091164 1
#SMS_3dbizToday 2015-12-06 19:29:03 89244391156 1
#SMS_3dbizToday 2015-12-06 19:29:03 79045904360 1
#SMS_3dbizToday 2015-12-06 19:29:04 79183775790 1
#SMS_3dbizToday 2015-12-06 19:29:04 79119200616 1
#SMS_3dbizToday 2015-12-06 19:29:04 79851532236 1
#SMS_3dbizToday 2015-12-06 19:29:04 37368449874 1
#SMS_3dbizToday 2015-12-06 19:29:04 79257237150 1
#SMS_3dbizToday 2015-12-06 19:29:04 79617631728 1
#SMS_3dbizToday 2015-12-06 19:29:05 79052647969 1
#SMS_3dbizToday 2015-12-06 19:29:05 89067477373 1
#SMS_3dbizToday 2015-12-06 19:29:05 79052299979 1
#SMS_3dbizToday 2015-12-06 19:29:05 79298140928 1
#SMS_3dbizToday 2015-12-06 19:29:05 79257781638 1
#SMS_3dbizToday 2015-12-06 19:29:05 79217669550 1
#SMS_3dbizToday 2015-12-06 19:29:06 79115091309 1
#SMS_3dbizToday 2015-12-06 19:29:06 89178240343 1
#SMS_3dbizToday 2015-12-06 19:29:07 79654676284 1
#SMS_3dbizToday 2015-12-06 19:29:07 380634106381 1
#SMS_3dbizToday 2015-12-06 19:29:07 79161229760 1
#SMS_3dbizToday 2015-12-06 19:29:07 79650552564 1
#SMS_3dbizToday 2015-12-06 19:29:08 79038745333 1
#SMS_3dbizToday 2015-12-06 19:29:08 79385314263 1
#SMS_3dbizToday 2015-12-06 19:29:08 79084480374 1
#SMS_3dbizToday 2015-12-06 19:29:08 79052883727 1
#SMS_3dbizToday  1111111 517
#SMS_3dbizToday 2015-12-06 19:29:09 380673057170 1
#SMS_3dbizToday  79482154645 517
#SMS_3dbizToday 2015-12-06 19:29:09 79183870847 1
#SMS_3dbizToday 2015-12-06 19:29:09 79223625217 1
#SMS_3dbizToday 2015-12-06 19:29:09 79617619115 1
#SMS_3dbizToday 2015-12-06 19:29:09 79203536571 1
#SMS_3dbizToday 2015-12-06 19:29:09 79506858962 1
#SMS_3dbizToday 2015-12-06 19:29:10 79244518160 1
#SMS_3dbizToday 2015-12-06 19:29:10 79103583099 1
#SMS_3dbizToday 2015-12-06 19:29:10 380954375130 1
#SMS_3dbizToday 2015-12-06 19:29:10 79602211119 1
#SMS_3dbizToday 2015-12-06 19:29:11 79144842181 1
#SMS_3dbizToday 2015-12-06 19:29:11 77014073856 1
#SMS_3dbizToday 2015-12-06 19:29:11 79851532236 1
#SMS_3dbizToday 2015-12-06 19:29:11 79618468222 1
#SMS_3dbizToday 2015-12-06 19:29:11 79263138830 1
#SMS_3dbizToday 2015-12-06 19:29:11 89151462143 1
#SMS_3dbizToday 2015-12-06 19:29:12 79272295727 1
#SMS_3dbizToday 2015-12-06 19:29:12 79656095833 1
#SMS_3dbizToday 2015-12-06 19:29:12 79656095833 1
#SMS_3dbizToday  134651373 517
#SMS_3dbizToday  134651373 517
#SMS_3dbizToday 2015-12-06 19:29:13 79258024746 1
#SMS_3dbizToday 2015-12-06 19:29:13 79183301507 1
#SMS_3dbizToday 2015-12-06 19:29:13 89108305550 1
#SMS_3dbizToday 2015-12-06 19:29:13 79617410222 1
#SMS_3dbizToday 2015-12-06 19:29:13 79653248429 1
#SMS_3dbizToday 2015-12-06 19:29:13 89119230325 1
#SMS_3dbizToday 2015-12-06 19:29:14 79289699985 1
#SMS_3dbizToday 2015-12-06 19:29:15 77075169605 1
#SMS_3dbizToday  7023303058 517
#SMS_3dbizToday  38063440584 517
#SMS_3dbizToday 2015-12-06 19:29:15 79685774734 1
#SMS_3dbizToday 2015-12-06 19:29:15 79210776323 1
#SMS_3dbizToday 2015-12-06 19:29:15 77776840004 1
#SMS_3dbizToday 2015-12-06 19:29:16 79119998355 1
#SMS_3dbizToday 2015-12-06 19:29:16 89061344823 1
#SMS_3dbizToday 2015-12-06 19:29:16 89031064722 1
#SMS_3dbizToday 2015-12-06 19:29:16 380637814226 1
#SMS_3dbizToday 2015-12-06 19:29:16 79214123124 1
start send sms 06.12.2015 19:30:20 from onair pages 
#SMS_3dbiz 2015-12-06 19:29:17 79200266002 1
#SMS_3dbiz 2015-12-06 19:29:17 89146123696 1
#SMS_3dbiz  998939904591 517
#SMS_3dbiz 2015-12-06 19:29:17 79827544393 1
#SMS_3dbiz 2015-12-06 19:29:17 79639789988 1
#SMS_3dbiz 2015-12-06 19:29:17 79643948668 1
#SMS_3dbiz 2015-12-06 19:29:18 79315395536 1
#SMS_3dbiz 2015-12-06 19:29:18 79183200555 1
#SMS_3dbiz 2015-12-06 19:29:18 79183200555 1
#SMS_3dbiz 2015-12-06 19:29:18 9176272921 1
#SMS_3dbiz 2015-12-06 19:29:18 79654433044 1
#SMS_3dbiz 2015-12-06 19:29:18 79274143646 1
#SMS_3dbiz  998935408383 517
#SMS_3dbiz  998935408383 517
#SMS_3dbiz 2015-12-06 19:29:20 79276069725 1
start send sms 06.12.2015 19:30:23 from newlp2 pages 
#SMS_newlp2 2015-12-06 19:29:20 +37455077073 1
#SMS_newlp2 2015-12-06 19:29:20 89179217264 1
#SMS_newlp2 2015-12-06 19:29:20 +7(961)3718691 1
#SMS_newlp2 2015-12-06 19:29:21 +380661764146 1
#SMS_newlp2 2015-12-06 19:29:21 +79787073272 1
#SMS_newlp2 2015-12-06 19:29:22 +375 33 6017506 1
#SMS_newlp2 2015-12-06 19:29:22 +79103783206 1
#SMS_newlp2 2015-12-06 19:29:23 +79836257585 1
#SMS_newlp2 2015-12-06 19:29:23 +79653248429 1
#SMS_newlp2 2015-12-06 19:29:23 87014877160 1
#SMS_newlp2 2015-12-06 19:29:23 +79138307935 1
#SMS_newlp2 2015-12-06 19:29:24 +79827544393 1
#SMS_newlp2 2015-12-06 19:29:24 +79039637710 1
#SMS_newlp2 2015-12-06 19:29:24 89133195033 1
#SMS_newlp2  +99365943331 517
#SMS_newlp2 2015-12-06 19:29:25 +79507601248 1
#SMS_newlp2 2015-12-06 19:29:25 9119907275 1
#SMS_newlp2 2015-12-06 19:29:25 89612991921 1
#SMS_newlp2 2015-12-06 19:29:25 +79128810544 1
#SMS_newlp2 2015-12-06 19:29:26 +7 (961) 593-01-78 1
#SMS_newlp2  +73467572065 517
#SMS_newlp2 2015-12-06 19:29:26 +380992622553 1
#SMS_newlp2 2015-12-06 19:29:26 89514519351 1
#SMS_newlp2  +78213613830 517
#SMS_newlp2 2015-12-06 19:29:26 +79628323337 1
#SMS_newlp2 2015-12-06 19:29:27 +79136824885 1
#SMS_newlp2 2015-12-06 19:29:27 +79023732399 1
#SMS_newlp2 2015-12-06 19:29:27 +79235086401 1
#SMS_newlp2 2015-12-06 19:29:28 +79110747190 1
#SMS_newlp2 2015-12-06 19:29:29 89531436485 1
#SMS_newlp2 2015-12-06 19:29:30 +7(950)190-54-70 1
#SMS_newlp2 2015-12-06 19:29:30 +79521849018 1
#SMS_newlp2 2015-12-06 19:29:30 89288975854 1
#SMS_newlp2 2015-12-06 19:29:30 +375333170643 1
#SMS_newlp2 2015-12-06 19:29:30 +79286615526 1
#SMS_newlp2 2015-12-06 19:29:30 +79088578542 1
#SMS_newlp2 2015-12-06 19:29:31 89833122209 1
#SMS_newlp2 2015-12-06 19:29:31 +79094721178 1
#SMS_newlp2 2015-12-06 19:29:31 +7 925 847 88 70 1
#SMS_newlp2 2015-12-06 19:29:31 +79507235323 1
#SMS_newlp2 2015-12-06 19:29:31 +79643948668 1
#SMS_newlp2 2015-12-06 19:29:31 +79183200555 1
#SMS_newlp2 2015-12-06 19:29:32 +79274143646 1
#SMS_newlp2  +998935408383 517
#SMS_newlp2 2015-12-06 19:29:32 +7 (927) 606-97-25 1
start send sms 07.12.2015 19:30:01 from onair pages (FOR TODAY) 
#SMS_3dbizToday 2015-12-07 19:28:56 380975885459 1
#SMS_3dbizToday 2015-12-07 19:28:56 79113085156 1
#SMS_3dbizToday 2015-12-07 19:28:56 79057964098 1
#SMS_3dbizToday 2015-12-07 19:28:57 79143392021 1
#SMS_3dbizToday 2015-12-07 19:28:57 79841713575 1
#SMS_3dbizToday 2015-12-07 19:28:58 89149805699 1
#SMS_3dbizToday 2015-12-07 19:28:59 79235839079 1
#SMS_3dbizToday 2015-12-07 19:28:59 79162622276 1
#SMS_3dbizToday 2015-12-07 19:28:59 9148891403 1
#SMS_3dbizToday 2015-12-07 19:29:00 89161110011 1
#SMS_3dbizToday 2015-12-07 19:29:00 79063417291 1
#SMS_3dbizToday 2015-12-07 19:29:00 375293676743 1
#SMS_3dbizToday 2015-12-07 19:29:00 89262945523 1
#SMS_3dbizToday  7594216948 517
#SMS_3dbizToday 2015-12-07 19:29:01 79053168001 1
#SMS_3dbizToday 2015-12-07 19:29:01 79123988827 1
#SMS_3dbizToday 2015-12-07 19:29:01 79655757472 1
#SMS_3dbizToday 2015-12-07 19:29:01 79127424138 1
#SMS_3dbizToday 2015-12-07 19:29:02 77019586486 1
#SMS_3dbizToday  7924752101 517
#SMS_3dbizToday  37377748112 517
#SMS_3dbizToday 2015-12-07 19:29:02 79086349396 1
#SMS_3dbizToday 2015-12-07 19:29:03 79165886620 1
#SMS_3dbizToday 2015-12-07 19:29:03 79048017572 1
#SMS_3dbizToday 2015-12-07 19:29:03 79165743407 1
#SMS_3dbizToday 2015-12-07 19:29:04 380997890930 1
#SMS_3dbizToday 2015-12-07 19:29:04 380988582408 1
#SMS_3dbizToday 2015-12-07 19:29:04 79637852280 1
#SMS_3dbizToday 2015-12-07 19:29:04 79528201571 1
#SMS_3dbizToday 2015-12-07 19:29:04 79610319999 1
#SMS_3dbizToday  74364561836 517
#SMS_3dbizToday 2015-12-07 19:29:05 79036521451 1
#SMS_3dbizToday 2015-12-07 19:29:05 380634756216 1
#SMS_3dbizToday 2015-12-07 19:29:05 79101701812 1
#SMS_3dbizToday 2015-12-07 19:29:05 79167666049 1
#SMS_3dbizToday 2015-12-07 19:29:05 89152843156 1
#SMS_3dbizToday 2015-12-07 19:29:06 89126375855 1
#SMS_3dbizToday 2015-12-07 19:29:06 79130436024 1
#SMS_3dbizToday 2015-12-07 19:29:06 37066204814 1
#SMS_3dbizToday  97297463661 517
#SMS_3dbizToday 2015-12-07 19:29:06 79119907275 1
#SMS_3dbizToday  34671812557 517
#SMS_3dbizToday 2015-12-07 19:29:07 998908086683 1
#SMS_3dbizToday 2015-12-07 19:29:07 380973706529 1
#SMS_3dbizToday 2015-12-07 19:29:07 79222879644 1
#SMS_3dbizToday 2015-12-07 19:29:07 79027633455 1
#SMS_3dbizToday 2015-12-07 19:29:08 79166238544 1
#SMS_3dbizToday 2015-12-07 19:29:08 89289644383 1
#SMS_3dbizToday 2015-12-07 19:29:08 79687140117 1
#SMS_3dbizToday 2015-12-07 19:29:08 89095136752 1
#SMS_3dbizToday 2015-12-07 19:29:08 79127161235 1
#SMS_3dbizToday 2015-12-07 19:29:08 79186225592 1
#SMS_3dbizToday 2015-12-07 19:29:08 79085139577 1
#SMS_3dbizToday 2015-12-07 19:29:09 79151561515 1
#SMS_3dbizToday 2015-12-07 19:29:09 79037183993 1
#SMS_3dbizToday  420776019337 517
#SMS_3dbizToday 2015-12-07 19:29:09 79271390953 1
#SMS_3dbizToday 2015-12-07 19:29:09 79220318907 1
#SMS_3dbizToday 2015-12-07 19:29:09 380678417405 1
#SMS_3dbizToday 2015-12-07 19:29:10 79129460176 1
#SMS_3dbizToday 2015-12-07 19:29:10 77073303330 1
#SMS_3dbizToday 2015-12-07 19:29:10 79878507211 1
#SMS_3dbizToday 2015-12-07 19:29:10 79037592425 1
#SMS_3dbizToday 2015-12-07 19:29:10 79119409885 1
#SMS_3dbizToday 2015-12-07 19:29:10 79203905255 1
#SMS_3dbizToday 2015-12-07 19:29:11 79045310343 1
#SMS_3dbizToday 2015-12-07 19:29:11 380502077180 1
#SMS_3dbizToday 2015-12-07 19:29:11 79807062444 1
#SMS_3dbizToday 2015-12-07 19:29:11 79060622298 1
#SMS_3dbizToday  75863254 517
#SMS_3dbizToday 2015-12-07 19:29:11 79091092166 1
#SMS_3dbizToday 2015-12-07 19:29:12 79312843095 1
#SMS_3dbizToday 2015-12-07 19:29:12 79521596008 1
#SMS_3dbizToday 2015-12-07 19:29:12 89162326254 1
#SMS_3dbizToday 2015-12-07 19:29:12 79887673657 1
#SMS_3dbizToday 2015-12-07 19:29:12 79128825836 1
#SMS_3dbizToday 2015-12-07 19:29:12 380505830974 1
#SMS_3dbizToday 2015-12-07 19:29:13 79148435618 1
#SMS_3dbizToday 2015-12-07 19:29:13 79060622298 1
#SMS_3dbizToday 2015-12-07 19:29:13 79222879644 1
#SMS_3dbizToday 2015-12-07 19:29:13 79184442269 1
#SMS_3dbizToday 2015-12-07 19:29:13 79136092869 1
#SMS_3dbizToday 2015-12-07 19:29:13 79872242768 1
#SMS_3dbizToday 2015-12-07 19:29:14 380975885459 1
#SMS_3dbizToday 2015-12-07 19:29:14 380975885459 1
#SMS_3dbizToday 2015-12-07 19:29:14 79269900428 1
#SMS_3dbizToday 2015-12-07 19:29:14 79134403345 1
#SMS_3dbizToday 2015-12-07 19:29:14 79165598997 1
#SMS_3dbizToday 2015-12-07 19:29:15 79169563625 1
#SMS_3dbizToday 2015-12-07 19:29:15 79173469379 1
#SMS_3dbizToday 2015-12-07 19:29:15 19737276418 1
#SMS_3dbizToday 2015-12-07 19:29:15 905535308889 1
#SMS_3dbizToday 2015-12-07 19:29:15 19737276418 1
#SMS_3dbizToday 2015-12-07 19:29:15 994553521077 1
#SMS_3dbizToday 2015-12-07 19:29:16 77057426654 1
#SMS_3dbizToday 2015-12-07 19:29:16 89215113457 1
#SMS_3dbizToday  360984483225 517
#SMS_3dbizToday 2015-12-07 19:29:16 79127512535 1
#SMS_3dbizToday 2015-12-07 19:29:16 79095889943 1
#SMS_3dbizToday 2015-12-07 19:29:17 79170998639 1
#SMS_3dbizToday 2015-12-07 19:29:17 79190634089 1
#SMS_3dbizToday 2015-12-07 19:29:17 79882350065 1
#SMS_3dbizToday 2015-12-07 19:29:17 380962609809 1
#SMS_3dbizToday 2015-12-07 19:29:17 79082052564 1
#SMS_3dbizToday 2015-12-07 19:29:17 79628784838 1
#SMS_3dbizToday 2015-12-07 19:29:18 79162171535 1
#SMS_3dbizToday 2015-12-07 19:29:18 79628784838 1
#SMS_3dbizToday 2015-12-07 19:29:18 79039718055 1
#SMS_3dbizToday 2015-12-07 19:29:18 89178670629 1
#SMS_3dbizToday 2015-12-07 19:29:18 79032323705 1
#SMS_3dbizToday 2015-12-07 19:29:18 79617410222 1
#SMS_3dbizToday 2015-12-07 19:29:19 375298099642 1
#SMS_3dbizToday 2015-12-07 19:29:19 79824900880 1
#SMS_3dbizToday 2015-12-07 19:29:19 79248580179 1
#SMS_3dbizToday 2015-12-07 19:29:19 380675761326 1
#SMS_3dbizToday 2015-12-07 19:29:19 79186481285 1
#SMS_3dbizToday 2015-12-07 19:29:19 79263903225 1
#SMS_3dbizToday 2015-12-07 19:29:20 89101010428 1
#SMS_3dbizToday 2015-12-07 19:29:20 79620835487 1
#SMS_3dbizToday 2015-12-07 19:29:20 79004805188 1
#SMS_3dbizToday 2015-12-07 19:29:20 380678017126 1
#SMS_3dbizToday 2015-12-07 19:29:20 79097307790 1
start send sms 07.12.2015 19:30:26 from onair pages 
#SMS_3dbiz  756875432 517
#SMS_3dbiz 2015-12-07 19:29:21 79266376686 1
#SMS_3dbiz  998974100400 517
#SMS_3dbiz 2015-12-07 19:29:21 79272295727 1
#SMS_3dbiz 2015-12-07 19:29:21 380637814226 1
#SMS_3dbiz 2015-12-07 19:29:21 380636778812 1
#SMS_3dbiz 2015-12-07 19:29:21 79617410222 1
#SMS_3dbiz 2015-12-07 19:29:22 79048017572 1
#SMS_3dbiz  75688546 517
#SMS_3dbiz 2015-12-07 19:29:22 380999775716 1
#SMS_3dbiz 2015-12-07 19:29:22 89220584932 1
#SMS_3dbiz 2015-12-07 19:29:22 79277928328 1
#SMS_3dbiz  998915023096 517
#SMS_3dbiz  75846325 517
#SMS_3dbiz 2015-12-07 19:29:23 89687470176 1
#SMS_3dbiz 2015-12-07 19:29:23 79217801484 1
#SMS_3dbiz 2015-12-07 19:29:23 89168867212 1
#SMS_3dbiz  7881080846545 517
#SMS_3dbiz 2015-12-07 19:29:23 79269400677 1
start send sms 07.12.2015 19:30:29 from newlp2 pages 
#SMS_newlp2 2015-12-07 19:29:24 +79162326343 1
#SMS_newlp2 2015-12-07 19:29:24 +79108071284 1
#SMS_newlp2  +97523754825 517
#SMS_newlp2 2015-12-07 19:29:24  +79275754563 1
#SMS_newlp2 2015-12-07 19:29:24 8 912 834 68 62 1
#SMS_newlp2 2015-12-07 19:29:24 +998909999240 1
#SMS_newlp2 2015-12-07 19:29:25 +7-921-4352761 1
#SMS_newlp2 2015-12-07 19:29:26 +7(916)828-7761 1
#SMS_newlp2 2015-12-07 19:29:26 +7(926)0282056 1
#SMS_newlp2 2015-12-07 19:29:26 +79609615261 1
#SMS_newlp2 2015-12-07 19:29:26 +79834693350 1
#SMS_newlp2 2015-12-07 19:29:27 89620775515 1
#SMS_newlp2 2015-12-07 19:29:27 +77017282090 1
#SMS_newlp2 2015-12-07 19:29:27 +7 (916) 217-15-35 1
#SMS_newlp2 2015-12-07 19:29:27 +79286630145 1
#SMS_newlp2 2015-12-07 19:29:27 +79115461080 1
#SMS_newlp2 2015-12-07 19:29:27 +7(915) 197-66-44 1
#SMS_newlp2 2015-12-07 19:29:27 +7 (925) 847 88 70 1
#SMS_newlp2 2015-12-07 19:29:28 +79213091164 1
#SMS_newlp2 2015-12-07 19:29:28 89244391156 1
#SMS_newlp2 2015-12-07 19:29:28 +7 904 590 43 60 1
#SMS_newlp2 2015-12-07 19:29:28 +79183775790 1
#SMS_newlp2 2015-12-07 19:29:28 +79119200616 1
#SMS_newlp2 2015-12-07 19:29:29 +7(985) 153-22-36 1
#SMS_newlp2 2015-12-07 19:29:29 +37368449874 1
#SMS_newlp2 2015-12-07 19:29:29 7 925 723 71 50 1
#SMS_newlp2 2015-12-07 19:29:29 +79617631728 1
#SMS_newlp2 2015-12-07 19:29:29 +79052647969 1
#SMS_newlp2 2015-12-07 19:29:29 89067477373 1
#SMS_newlp2 2015-12-07 19:29:30 +7(905)2299979 1
#SMS_newlp2 2015-12-07 19:29:30 +7(929)8140928 1
#SMS_newlp2 2015-12-07 19:29:30 +79257781638 1
#SMS_newlp2 2015-12-07 19:29:30 +79217669550 1
#SMS_newlp2 2015-12-07 19:29:30 +79115091309 1
#SMS_newlp2 2015-12-07 19:29:30 89178240343 1
#SMS_newlp2 2015-12-07 19:29:31 +79654676284 1
#SMS_newlp2 2015-12-07 19:29:31 +380634106381 1
#SMS_newlp2 2015-12-07 19:29:31 +79161229760 1
#SMS_newlp2 2015-12-07 19:29:31 +7(965)-055-25-64 1
#SMS_newlp2 2015-12-07 19:29:31 +79038745333 1
#SMS_newlp2 2015-12-07 19:29:31 +7 9385314263 1
#SMS_newlp2 2015-12-07 19:29:32 +79084480374 1
#SMS_newlp2 2015-12-07 19:29:32 +79052883727 1
#SMS_newlp2  111-11-11 517
#SMS_newlp2 2015-12-07 19:29:32 +380673057170 1
#SMS_newlp2  +79482154645 517
#SMS_newlp2 2015-12-07 19:29:33 +79183870847 1
#SMS_newlp2 2015-12-07 19:29:33 +79223625217 1
#SMS_newlp2 2015-12-07 19:29:33 +7(961)7619115 1
#SMS_newlp2 2015-12-07 19:29:33 +79203536571 1
#SMS_newlp2 2015-12-07 19:29:33 79506858962 1
#SMS_newlp2 2015-12-07 19:29:33 +79244518160 1
#SMS_newlp2 2015-12-07 19:29:34 +79103583099 1
#SMS_newlp2 2015-12-07 19:29:34 +380954375130 1
#SMS_newlp2 2015-12-07 19:29:34 +79602211119 1
#SMS_newlp2 2015-12-07 19:29:34 +79144842181 1
#SMS_newlp2 2015-12-07 19:29:34 +77014073856 1
#SMS_newlp2 2015-12-07 19:29:34 +7(985) 153-22-36 1
#SMS_newlp2 2015-12-07 19:29:35 +79263138830 1
#SMS_newlp2 2015-12-07 19:29:35 89151462143 1
#SMS_newlp2 2015-12-07 19:29:35 +7 (965)609 58 33 1
#SMS_newlp2 2015-12-07 19:29:35 +7(965)6095833 1
#SMS_newlp2  0134651373 517
#SMS_newlp2  0134651373 517
#SMS_newlp2 2015-12-07 19:29:36 +79258024746 1
#SMS_newlp2 2015-12-07 19:29:36 +7 (918) 3301507 1
#SMS_newlp2 2015-12-07 19:29:36 89108305550 1
#SMS_newlp2 2015-12-07 19:29:36 +7(961)741 0 222 1
#SMS_newlp2 2015-12-07 19:29:37 +79653248429 1
#SMS_newlp2 2015-12-07 19:29:37 8(911)923-03-25 1
#SMS_newlp2 2015-12-07 19:29:37 +79289699985 1
#SMS_newlp2 2015-12-07 19:29:37 +77075169605 1
#SMS_newlp2  +7023303058 517
#SMS_newlp2  +38063440584 517
#SMS_newlp2 2015-12-07 19:29:38 79685774734 1
#SMS_newlp2 2015-12-07 19:29:38 +79210776323 1
#SMS_newlp2 2015-12-07 19:29:38 +77776840004 1
#SMS_newlp2 2015-12-07 19:29:38 +79119998355 1
#SMS_newlp2 2015-12-07 19:29:38 89061344823 1
#SMS_newlp2 2015-12-07 19:29:39 89031064722 1
#SMS_newlp2 2015-12-07 19:29:39 +380637814226 1
#SMS_newlp2 2015-12-07 19:29:39 +79214123124 1
#SMS_newlp2 2015-12-07 19:29:39 +79295555721 1
#SMS_newlp2 2015-12-07 19:29:39 +79104000970 1
#SMS_newlp2 2015-12-07 19:29:40 +79501907045 1
#SMS_newlp2  099-37-18-20 517
#SMS_newlp2 2015-12-07 19:29:40 +7(961)741-02-22 1
#SMS_newlp2 2015-12-07 19:29:40 +79048017572 1
#SMS_newlp2  ???????????? 510
#SMS_newlp2 2015-12-07 19:29:40 +380999775716 1
#SMS_newlp2 2015-12-07 19:29:41 8 922 058 49 32 1
#SMS_newlp2 2015-12-07 19:29:41 +79277928328 1
#SMS_newlp2 2015-12-07 19:29:41 8 968 747 01 76 1
#SMS_newlp2 2015-12-07 19:29:41 +7(921)7801484 1
#SMS_newlp2 2015-12-07 19:29:42 8-916-886-72-12 1
#SMS_newlp2  7881080846545 517
#SMS_newlp2 2015-12-07 19:29:42 +7 (926) 940 06 77 1
start send sms 08.12.2015 19:30:01 from onair pages (FOR TODAY) 
#SMS_3dbizToday 2015-12-08 19:28:54 79169223071 1
#SMS_3dbizToday 2015-12-08 19:28:54 375336717505 1
#SMS_3dbizToday 2015-12-08 19:28:54 380505749420 1
#SMS_3dbizToday 2015-12-08 19:28:55 79511243418 1
#SMS_3dbizToday 2015-12-08 19:28:55 87076045015 1
#SMS_3dbizToday 2015-12-08 19:28:55 380637134863 1
#SMS_3dbizToday 2015-12-08 19:28:55 79089168896 1
#SMS_3dbizToday 2015-12-08 19:28:55 998909458779 1
#SMS_3dbizToday 2015-12-08 19:28:55 996557025039 1
#SMS_3dbizToday 2015-12-08 19:28:56 79675054404 1
#SMS_3dbizToday 2015-12-08 19:28:56 79897558886 1
#SMS_3dbizToday 2015-12-08 19:28:56 995555471138 1
#SMS_3dbizToday 2015-12-08 19:28:56 380683891465 1
#SMS_3dbizToday 2015-12-08 19:28:56 79181060000 1
#SMS_3dbizToday 2015-12-08 19:28:57 996557025039 1
#SMS_3dbizToday 2015-12-08 19:28:57 77073303330 1
#SMS_3dbizToday 2015-12-08 19:28:57 79539121717 1
#SMS_3dbizToday 2015-12-08 19:28:57 77073303330 1
#SMS_3dbizToday 2015-12-08 19:28:57 380664351490 1
#SMS_3dbizToday 2015-12-08 19:28:57 359884776686 1
#SMS_3dbizToday 2015-12-08 19:28:58 89222524566 1
#SMS_3dbizToday 2015-12-08 19:28:58 89131102020 1
#SMS_3dbizToday 2015-12-08 19:28:58 87759750078 1
#SMS_3dbizToday 2015-12-08 19:28:58 89049262309 1
start send sms 08.12.2015 19:30:06 from onair pages 
#SMS_3dbiz 2015-12-08 19:28:58 79086987038 1
#SMS_3dbiz 2015-12-08 19:28:58 89038125030 1
#SMS_3dbiz 2015-12-08 19:28:59 998908086683 1
#SMS_3dbiz 2015-12-08 19:28:59 998909500213 1
#SMS_3dbiz 2015-12-08 19:28:59 89134957750 1
#SMS_3dbiz 2015-12-08 19:28:59 79219779277 1
#SMS_3dbiz 2015-12-08 19:28:59 79035902119 1
#SMS_3dbiz  80674841908 517
#SMS_3dbiz  75863254 517
#SMS_3dbiz  2132123123132 517
start send sms 08.12.2015 19:30:07 from newlp2 pages 
#SMS_newlp2 2015-12-08 19:29:00 +3 8 (097) 588 54 59 1
#SMS_newlp2 2015-12-08 19:29:00 +7 (911) 308-51-56 1
#SMS_newlp2 2015-12-08 19:29:00 +79057964098 1
#SMS_newlp2 2015-12-08 19:29:00 +79143392021 1
#SMS_newlp2 2015-12-08 19:29:01 +7(984)1713575 1
#SMS_newlp2 2015-12-08 19:29:01 89149805699 1
#SMS_newlp2 2015-12-08 19:29:01 +7 (923) 583-90-79 1
#SMS_newlp2  + 510
#SMS_newlp2 2015-12-08 19:29:01 +79162622276 1
#SMS_newlp2 2015-12-08 19:29:02 89161110011 1
#SMS_newlp2 2015-12-08 19:29:02 +7 (906) 3417291 1
#SMS_newlp2 2015-12-08 19:29:03 +375293676743 1
#SMS_newlp2 2015-12-08 19:29:04 8 (926) 294-55-23 1
#SMS_newlp2  07594216948 517
#SMS_newlp2 2015-12-08 19:29:04 +7 905 316 80 01 1
#SMS_newlp2 2015-12-08 19:29:04 +79123988827 1
#SMS_newlp2 2015-12-08 19:29:04 +79655757472 1
#SMS_newlp2 2015-12-08 19:29:05 +7 (912) 742-41-38 1
#SMS_newlp2 2015-12-08 19:29:05 +77019586486 1
#SMS_newlp2  +7924752101 517
#SMS_newlp2  +37377748112 517
#SMS_newlp2 2015-12-08 19:29:05 +7(908)634-93-96 1
#SMS_newlp2 2015-12-08 19:29:06 +7(916)588-66-20 1
#SMS_newlp2 2015-12-08 19:29:06 +79048017572 1
#SMS_newlp2 2015-12-08 19:29:06 +79165743407 1
#SMS_newlp2 2015-12-08 19:29:06 +38(098)8582408 1
#SMS_newlp2 2015-12-08 19:29:06 +79637852280 1
#SMS_newlp2 2015-12-08 19:29:07 +79528201571 1
#SMS_newlp2 2015-12-08 19:29:08 +79610319999 1
#SMS_newlp2  +7(436)4561836 517
#SMS_newlp2 2015-12-08 19:29:08 +79036521451 1
#SMS_newlp2 2015-12-08 19:29:08 +380634756216 1
#SMS_newlp2 2015-12-08 19:29:09 79101701812 1
#SMS_newlp2 2015-12-08 19:29:09 +79167666049 1
#SMS_newlp2 2015-12-08 19:29:09 +8 (915) 284-31-56 1
#SMS_newlp2 2015-12-08 19:29:09 89126375855 1
#SMS_newlp2 2015-12-08 19:29:09 +79130436024 1
#SMS_newlp2 2015-12-08 19:29:09 +37066204814 1
#SMS_newlp2  +97297463661 517
#SMS_newlp2 2015-12-08 19:29:10 +79119907275 1
#SMS_newlp2  +34 671 812 557 517
#SMS_newlp2 2015-12-08 19:29:10 +998908086683 1
#SMS_newlp2 2015-12-08 19:29:10 +38 097 370 65 29 1
#SMS_newlp2 2015-12-08 19:29:11 +79222879644 1
#SMS_newlp2 2015-12-08 19:29:11 +7(902)7633455 1
#SMS_newlp2 2015-12-08 19:29:12 +79166238544 1
#SMS_newlp2 2015-12-08 19:29:12 89289644383 1
#SMS_newlp2 2015-12-08 19:29:12 79687140117 1
#SMS_newlp2 2015-12-08 19:29:12 89095136752 1
#SMS_newlp2 2015-12-08 19:29:13 +79127161235 1
#SMS_newlp2 2015-12-08 19:29:13 +79186225592 1
#SMS_newlp2 2015-12-08 19:29:13 +79085139577 1
#SMS_newlp2 2015-12-08 19:29:13 +79151561515 1
#SMS_newlp2 2015-12-08 19:29:13 +7(903)7183993 1
#SMS_newlp2  +420776019337 517
#SMS_newlp2 2015-12-08 19:29:14 +7 927 139 0953 1
#SMS_newlp2 2015-12-08 19:29:14 +7 922 0318907 1
#SMS_newlp2 2015-12-08 19:29:14 +380678417405 1
#SMS_newlp2 2015-12-08 19:29:14 +79129460176 1
#SMS_newlp2 2015-12-08 19:29:14 +7 707 330 33 30 1
#SMS_newlp2 2015-12-08 19:29:15 +79878507211 1
#SMS_newlp2 2015-12-08 19:29:15 +79037592425 1
#SMS_newlp2 2015-12-08 19:29:15 +79119409885 1
#SMS_newlp2 2015-12-08 19:29:15 +79203905255 1
#SMS_newlp2 2015-12-08 19:29:15 +7 904 531 03 43 1
#SMS_newlp2 2015-12-08 19:29:15 +380502077180 1
#SMS_newlp2 2015-12-08 19:29:16 +79807062444 1
#SMS_newlp2 2015-12-08 19:29:16 +79060622298  1
#SMS_newlp2 2015-12-08 19:29:16 +79091092166 1
#SMS_newlp2 2015-12-08 19:29:16 +79312843095 1
#SMS_newlp2 2015-12-08 19:29:16 +7 (952) 159-60-08 1
#SMS_newlp2 2015-12-08 19:29:16 89162326254 1
#SMS_newlp2 2015-12-08 19:29:17 +79887673657 1
#SMS_newlp2 2015-12-08 19:29:17 +79128825836 1
#SMS_newlp2 2015-12-08 19:29:17 +380505830974 1
#SMS_newlp2 2015-12-08 19:29:17 +79184442269 1
#SMS_newlp2 2015-12-08 19:29:17 +7 913 609 2869 1
#SMS_newlp2 2015-12-08 19:29:18 +79872242768 1
#SMS_newlp2 2015-12-08 19:29:18 +7(926)9900428 1
#SMS_newlp2 2015-12-08 19:29:18 +79134403345 1
#SMS_newlp2 2015-12-08 19:29:18 +7 (916) 559-89-97 1
#SMS_newlp2 2015-12-08 19:29:18 +79169563625 1
#SMS_newlp2 2015-12-08 19:29:19 +1(973)727-6418 1
#SMS_newlp2 2015-12-08 19:29:19 89215113457 1
#SMS_newlp2  +360984483225| 517
#SMS_newlp2 2015-12-08 19:29:19 +79127512535 1
#SMS_newlp2 2015-12-08 19:29:19 +7 917 099 86 39 1
#SMS_newlp2 2015-12-08 19:29:19 +79882350065 1
#SMS_newlp2 2015-12-08 19:29:20 +380962609809 1
#SMS_newlp2 2015-12-08 19:29:20 +79628784838 1
#SMS_newlp2 2015-12-08 19:29:20 +79032323705 1
#SMS_newlp2 2015-12-08 19:29:20 +7 (924) 858 01-79 1
#SMS_newlp2 2015-12-08 19:29:20 +380675761326 1
#SMS_newlp2 2015-12-08 19:29:21 +79620835487 1
#SMS_newlp2 2015-12-08 19:29:21 +79004805188 1
#SMS_newlp2 2015-12-08 19:29:21 +380678017126 1
#SMS_newlp2 2015-12-08 19:29:21 +79097307790 1
#SMS_newlp2 2015-12-08 19:29:21 +79528980501 1
#SMS_newlp2 2015-12-08 19:29:21 +79106001960 1
#SMS_newlp2  +7952980501 517
#SMS_newlp2 2015-12-08 19:29:22 +79036665364 1
#SMS_newlp2  2132123123132 517
start send sms 09.12.2015 19:30:02 from onair pages (FOR TODAY) 
#SMS_3dbizToday 2015-12-09 19:28:52 89617733502 1
#SMS_3dbizToday 2015-12-09 19:28:52 79165126992 1
#SMS_3dbizToday 2015-12-09 19:28:52 79126203515 1
#SMS_3dbizToday 2015-12-09 19:28:53 79250373885 1
#SMS_3dbizToday 2015-12-09 19:28:53 998903749979 1
#SMS_3dbizToday  75869745 517
#SMS_3dbizToday  386667771111 517
#SMS_3dbizToday 2015-12-09 19:28:53 79108113040 1
#SMS_3dbizToday 2015-12-09 19:28:53 79203576290 1
#SMS_3dbizToday 2015-12-09 19:28:54 89040349708 1
#SMS_3dbizToday 2015-12-09 19:28:54 79858904061 1
#SMS_3dbizToday 2015-12-09 19:28:54 79119398356 1
start send sms 09.12.2015 19:30:04 from onair pages 
#SMS_3dbiz 2015-12-09 19:28:54 89036783192 1
#SMS_3dbiz 2015-12-09 19:28:54 89083129789 1
#SMS_3dbiz 2015-12-09 19:28:55 79267014144 1
#SMS_3dbiz 2015-12-09 19:28:55 79321143818 1
#SMS_3dbiz 2015-12-09 19:28:55 79181060000 1
#SMS_3dbiz 2015-12-09 19:28:55 996557025039 1
#SMS_3dbiz 2015-12-09 19:28:55 79539121717 1
#SMS_3dbiz 2015-12-09 19:28:55 380681334827 1
#SMS_3dbiz 2015-12-09 19:28:56 89179442105 1
#SMS_3dbiz 2015-12-09 19:28:56 79632856894 1
#SMS_3dbiz 2015-12-09 19:28:56 380969427623 1
#SMS_3dbiz 2015-12-09 19:28:56 79031086101 1
#SMS_3dbiz  758623654 517
#SMS_3dbiz 2015-12-09 19:28:56 79064292556 1
#SMS_3dbiz 2015-12-09 19:28:57 89531436485 1
#SMS_3dbiz 2015-12-09 19:28:57 79272101035 1
#SMS_3dbiz 2015-12-09 19:28:57 79272101035 1
start send sms 09.12.2015 19:30:07 from newlp2 pages 
#SMS_newlp2 2015-12-09 19:28:57 +996557025039 1
#SMS_newlp2 2015-12-09 19:28:57 +79181060000 1
#SMS_newlp2 2015-12-09 19:28:58 +996(557)025039 1
#SMS_newlp2 2015-12-09 19:28:58 +380664351490 1
#SMS_newlp2 2015-12-09 19:28:58 8 (904) 926-23-09 1
#SMS_newlp2  + 510
#SMS_newlp2 2015-12-09 19:28:58 89531436485 1
#SMS_newlp2 2015-12-09 19:28:58 +79272101035 1
start send sms 10.12.2015 19:30:01 from onair pages (FOR TODAY) 
#SMS_3dbizToday 2015-12-10 19:28:49 998903480304 1
#SMS_3dbizToday 2015-12-10 19:28:49 998903480304 1
#SMS_3dbizToday 2015-12-10 19:28:49 79994658808 1
#SMS_3dbizToday 2015-12-10 19:28:49 79097727102 1
start send sms 10.12.2015 19:30:01 from onair pages 
#SMS_3dbiz 2015-12-10 19:28:50 89179442105 1
#SMS_3dbiz 2015-12-10 19:28:50 79068536107 1
#SMS_3dbiz 2015-12-10 19:28:50 89874960212 1
#SMS_3dbiz 2015-12-10 19:28:50 79166391601 1
#SMS_3dbiz 2015-12-10 19:28:50 79645631126 1
#SMS_3dbiz 2015-12-10 19:28:50 89602839918 1
#SMS_3dbiz 2015-12-10 19:28:51 79601950600 1
#SMS_3dbiz 2015-12-10 19:28:51 380505900440 1
#SMS_3dbiz 2015-12-10 19:28:51 79128162714 1
#SMS_3dbiz  74568247 517
#SMS_3dbiz  75846596 517
#SMS_3dbiz  78565421 517
#SMS_3dbiz 2015-12-10 19:28:52 79032131816 1
#SMS_3dbiz 2015-12-10 19:28:52 79032131816 1
#SMS_3dbiz 2015-12-10 19:28:52 89522288246 1
#SMS_3dbiz 2015-12-10 19:28:52 380936561518 1
start send sms 10.12.2015 19:30:04 from newlp2 pages 
#SMS_newlp2 2015-12-10 19:28:52 +7(916)512-69-92 1
#SMS_newlp2 2015-12-10 19:28:52 +79126203515 1
#SMS_newlp2 2015-12-10 19:28:53 +79250373885 1
#SMS_newlp2  +386667771111 517
#SMS_newlp2 2015-12-10 19:28:53 +79203576290 1
#SMS_newlp2 2015-12-10 19:28:53 +79858904061 1
#SMS_newlp2 2015-12-10 19:28:53 +79032131816 1
start send sms 11.12.2015 19:30:01 from onair pages (FOR TODAY) 
#SMS_3dbizToday 2015-12-11 19:28:47 9296780308 1
#SMS_3dbizToday 2015-12-11 19:28:48 79819734810 1
#SMS_3dbizToday 2015-12-11 19:28:48 79630857000 1
#SMS_3dbizToday 2015-12-11 19:28:48 79037654480 1
#SMS_3dbizToday  998946587648 517
start send sms 11.12.2015 19:30:02 from onair pages 
#SMS_3dbiz 2015-12-11 19:28:48 89655384444 1
#SMS_3dbiz 2015-12-11 19:28:49 79658996739 1
#SMS_3dbiz 2015-12-11 19:28:49 79177670006 1
#SMS_3dbiz 2015-12-11 19:28:49 79181195761 1
#SMS_3dbiz 2015-12-11 19:28:49 79179442105 1
#SMS_3dbiz 2015-12-11 19:28:49 79994658808 1
#SMS_3dbiz 2015-12-11 19:28:49 89020072870 1
#SMS_3dbiz 2015-12-11 19:28:50 79636545949 1
#SMS_3dbiz 2015-12-11 19:28:50 79093984422 1
#SMS_3dbiz 2015-12-11 19:28:50 79172850898 1
#SMS_3dbiz 2015-12-11 19:28:50 79128166263 1
#SMS_3dbiz  998935100010 517
#SMS_3dbiz  998935100010 517
#SMS_3dbiz  998935100010 517
#SMS_3dbiz 2015-12-11 19:28:51 89180878250 1
start send sms 11.12.2015 19:30:05 from newlp2 pages 
#SMS_newlp2 2015-12-11 19:28:51 +998903480304 1
#SMS_newlp2 2015-12-11 19:28:51 +79994658808 1
start send sms 12.12.2015 19:30:01 from onair pages (FOR TODAY) 
#SMS_3dbizToday 2015-12-12 19:28:45 89218984636 1
#SMS_3dbizToday 2015-12-12 19:28:45 380975737953 1
#SMS_3dbizToday 2015-12-12 19:28:45 77074204648 1
#SMS_3dbizToday 2015-12-12 19:28:45 380635735871 1
#SMS_3dbizToday 2015-12-12 19:28:45 79296780308 1
#SMS_3dbizToday 2015-12-12 19:28:46 79095846005 1
start send sms 12.12.2015 19:30:02 from onair pages 
#SMS_3dbiz 2015-12-12 19:28:46 79627770007 1
#SMS_3dbiz  7950033549 517
#SMS_3dbiz  38050964532 517
#SMS_3dbiz 2015-12-12 19:28:46 89885446112 1
#SMS_3dbiz 2015-12-12 19:28:46 89273277099 1
#SMS_3dbiz 2015-12-12 19:28:47 79511654782 1
#SMS_3dbiz 2015-12-12 19:28:47 89603779333 1
#SMS_3dbiz 2015-12-12 19:28:47 89031692152 1
#SMS_3dbiz 2015-12-12 19:28:47 89031692152 1
#SMS_3dbiz 2015-12-12 19:28:47 89211579853 1
#SMS_3dbiz 2015-12-12 19:28:47 89288596657 1
#SMS_3dbiz 2015-12-12 19:28:48 79104196020 1
#SMS_3dbiz 2015-12-12 19:28:48 89023145535 1
start send sms 12.12.2015 19:30:04 from newlp2 pages 
#SMS_newlp2 2015-12-12 19:28:48 9296780308 1
#SMS_newlp2 2015-12-12 19:28:48 79819734810 1
#SMS_newlp2 2015-12-12 19:28:48 +7 903 765 44 80 1
#SMS_newlp2 2015-12-12 19:28:48 79511654782 1
#SMS_newlp2 2015-12-12 19:28:49 89031692152 1
#SMS_newlp2 2015-12-12 19:28:49 8 902 314 55 35 1
start send sms 13.12.2015 19:30:01 from onair pages (FOR TODAY) 
#SMS_3dbizToday  38066663214 517
#SMS_3dbizToday 2015-12-13 19:28:43 359896830130 1
#SMS_3dbizToday 2015-12-13 19:28:43 87073303300 1
#SMS_3dbizToday 2015-12-13 19:28:43 79280296410 1
#SMS_3dbizToday 2015-12-13 19:28:44 79145466380 1
#SMS_3dbizToday 2015-12-13 19:28:44 380685801446 1
start send sms 13.12.2015 19:30:02 from onair pages 
#SMS_3dbiz 2015-12-13 19:28:44 87026583824 1
#SMS_3dbiz 2015-12-13 19:28:44 79787162404 1
#SMS_3dbiz 2015-12-13 19:28:44 380501016869 1
#SMS_3dbiz 2015-12-13 19:28:45 380975737953 1
#SMS_3dbiz 2015-12-13 19:28:45 79097263100 1
#SMS_3dbiz 2015-12-13 19:28:45 77074204648 1
#SMS_3dbiz 2015-12-13 19:28:45 380635735871 1
#SMS_3dbiz 2015-12-13 19:28:45 79169000385 1
#SMS_3dbiz 2015-12-13 19:28:45 87475237320 1
#SMS_3dbiz 2015-12-13 19:28:46 79635751797 1
#SMS_3dbiz  675045922 517
#SMS_3dbiz 2015-12-13 19:28:46 89013732823 1
#SMS_3dbiz 2015-12-13 19:28:46 77470146807 1
start send sms 13.12.2015 19:30:05 from newlp2 pages 
#SMS_newlp2 2015-12-13 19:28:47 +380975737953 1
#SMS_newlp2 2015-12-13 19:28:47 +7(707)420 46 48 1
#SMS_newlp2 2015-12-13 19:28:47 +79095846005 1
start send sms 14.12.2015 19:30:01 from onair pages (FOR TODAY) 
#SMS_3dbizToday  998946110871 517
#SMS_3dbizToday  70954568451 517
#SMS_3dbizToday 2015-12-14 19:28:41 89102835070 1
